isbn,title,authors,description,subjects,text,wiki_description
0553280368,"""C"" is for corpse",Sue Grafton,,"Fiction, Kinsey Millhone (Fictitious character), Women private investigators, Private investigators, Detective and mystery stories, Women detectives, Murder, Fiction, mystery & detective, women sleuths, Millhone, kinsey (fictitious character), fiction, Santa teresa (calif. : imaginary place), fiction, Private investigators, fiction, Large type books, Kinsey Millhone (Fictional character), Mystery fiction","""C"" is for corpse Sue Grafton Fiction, Kinsey Millhone (Fictitious character), Women private investigators, Private investigators, Detective and mystery stories, Women detectives, Murder, Fiction, mystery & detective, women sleuths, Millhone, kinsey (fictitious character), fiction, Santa teresa (calif. : imaginary place), fiction, Private investigators, fiction, Large type books, Kinsey Millhone (Fictional character), Mystery fiction",
0553569783,Heartstone,Phillip Margolin,,"Murder, Detective and mystery stories, Fiction","Heartstone Phillip Margolin Murder, Detective and mystery stories, Fiction",Heartstone may refer to:
0586209581,Mystery,Peter Straub,,"Mystery fiction, Detective and mystery stories, Fiction, horror, Fiction, psychological, Pasmore, tom (fictitious character), fiction, Horror stories, Mystery and detective stories","Mystery Peter Straub Mystery fiction, Detective and mystery stories, Fiction, horror, Fiction, psychological, Pasmore, tom (fictitious character), fiction, Horror stories, Mystery and detective stories","Mystery, The Mystery, Mysteries or The Mysteries may refer to:"
059035342X,Harry Potter and the Sorcerer's Stone,J. K. Rowling,,"Ghosts, Monsters, Vampires, Witches, Challenges and Overcoming Obstacles, Magic and Supernatural, Cleverness, School Life, school stories, Wizards, Magic, MAGIA, MAGOS, Juvenile fiction, Fiction, NOVELAS INGLESAS, Schools, orphans, fantasy fiction, England in fiction, Witches in fiction, Wizards in fiction, Alchemy, New York Times bestseller, Juvenile literature, Magic in fiction, Open Library Staff Picks, Juvenile audience, Children's stories, Juvenile works, Schools in fiction, Fantasy, Hogwarts School of Witchcraft and Wizardry (Imaginary place), Harry Potter (Fictitious character), Ficción juvenil, Escuelas, Hogwarts School of Witchcraft and Wizardry (Imaginary organization), Translations from English, Chinese fiction, Hermione Granger (Fictitious character), Reading Level-Grade 9, Reading Level-Grade 11, Reading Level-Grade 10, Reading Level-Grade 12, Hogwarts school of witchcraft and wizardry (imaginary organization), fiction, Children's fiction, Schools, fiction, England, fiction, Potter, harry (fictitious character), fiction, Wizards, fiction, Magic, fiction, Fiction, fantasy, general, Magier, Fabeltiere, Lehrling, Kinderbuch, Stein der Weisen, Ungeheuer, Junge, English language, Translating into Welsh, Modern history to 20th century: c 1700 to c 1900, Literary theory, English literature, Ron Weasley (Fictitious character), Latin language materials, Romans, nouvelles, etc. pour la jeunesse, Poudlard, école de sorcellerie (Organisation imaginaire), Sorciers, Sorcières, Magie, Internats, Adventure and adventurers, fiction, Action & Adventure, Fantasy & Magic, Social Themes, Friendship, Harry Potter (Fictional character), Friendship, fiction, German language materials, Witchcraft, fiction, Wizard, NOVELAS FANTÁSTICAS, NOVELAS JUVENILES INGLESAS, LITERATURA JUVENIL ESTADOUNIDENSE, Écoles, Hechicería, Novela juvenil, Ingleterra, Mystery, roman, English Fantasy literature, Translations into Marathi, English fiction, Translations into Chinese, Children - harry potter, Teen fiction, Children - fiction & literature, Science fiction & fantasy, Fiction - people, Places & cultures, Adventure, Supernatural, harry potter, j.k rowling, spanish","Harry Potter and the Sorcerer's Stone J. K. Rowling Ghosts, Monsters, Vampires, Witches, Challenges and Overcoming Obstacles, Magic and Supernatural, Cleverness, School Life, school stories, Wizards, Magic, MAGIA, MAGOS, Juvenile fiction, Fiction, NOVELAS INGLESAS, Schools, orphans, fantasy fiction, England in fiction, Witches in fiction, Wizards in fiction, Alchemy, New York Times bestseller, Juvenile literature, Magic in fiction, Open Library Staff Picks, Juvenile audience, Children's stories, Juvenile works, Schools in fiction, Fantasy, Hogwarts School of Witchcraft and Wizardry (Imaginary place), Harry Potter (Fictitious character), Ficción juvenil, Escuelas, Hogwarts School of Witchcraft and Wizardry (Imaginary organization), Translations from English, Chinese fiction, Hermione Granger (Fictitious character), Reading Level-Grade 9, Reading Level-Grade 11, Reading Level-Grade 10, Reading Level-Grade 12, Hogwarts school of witchcraft and wizardry (imaginary organization), fiction, Children's fiction, Schools, fiction, England, fiction, Potter, harry (fictitious character), fiction, Wizards, fiction, Magic, fiction, Fiction, fantasy, general, Magier, Fabeltiere, Lehrling, Kinderbuch, Stein der Weisen, Ungeheuer, Junge, English language, Translating into Welsh, Modern history to 20th century: c 1700 to c 1900, Literary theory, English literature, Ron Weasley (Fictitious character), Latin language materials, Romans, nouvelles, etc. pour la jeunesse, Poudlard, école de sorcellerie (Organisation imaginaire), Sorciers, Sorcières, Magie, Internats, Adventure and adventurers, fiction, Action & Adventure, Fantasy & Magic, Social Themes, Friendship, Harry Potter (Fictional character), Friendship, fiction, German language materials, Witchcraft, fiction, Wizard, NOVELAS FANTÁSTICAS, NOVELAS JUVENILES INGLESAS, LITERATURA JUVENIL ESTADOUNIDENSE, Écoles, Hechicería, Novela juvenil, Ingleterra, Mystery, roman, English Fantasy literature, Translations into Marathi, English fiction, Translations into Chinese, Children - harry potter, Teen fiction, Children - fiction & literature, Science fiction & fantasy, Fiction - people, Places & cultures, Adventure, Supernatural, harry potter, j.k rowling, spanish","Harry Potter and the Philosopher's Stone is a fantasy novel written by British author J. K. Rowling. It is the first novel in the Harry Potter series and was Rowling's debut novel. It follows Harry Potter, a young wizard who discovers his magical heritage on his eleventh birthday when he receives a letter of acceptance to Hogwarts School of Witchcraft and Wizardry."
0590449869,The mystery of the hidden painting,"Gertrude Chandler Warner, Charles Tang",,"Juvenile fiction, Fiction, Orphans, Brothers and sisters, Boxcar children (Fictitious characters), Grandfathers, Mystery and detective stories, Families, Family, Detective and mystery stories, Political corruption, Trials (Political crimes and offenses), Children's fiction, Boxcar children (fictitious characters), fiction, Orphans, fiction, Large type books, series:BoxcarChildren, collectionID:Boxcar2, Siblings, fiction, Family, fiction, Grandparents, fiction","The mystery of the hidden painting Gertrude Chandler Warner, Charles Tang Juvenile fiction, Fiction, Orphans, Brothers and sisters, Boxcar children (Fictitious characters), Grandfathers, Mystery and detective stories, Families, Family, Detective and mystery stories, Political corruption, Trials (Political crimes and offenses), Children's fiction, Boxcar children (fictitious characters), fiction, Orphans, fiction, Large type books, series:BoxcarChildren, collectionID:Boxcar2, Siblings, fiction, Family, fiction, Grandparents, fiction",
0671027360,Angels & demons,Dan Brown,,"heparin, ambigrams, antimatter, Freemasons, Swiss Guard, Murder, Investigation, Women scientists, College teachers, Terrorism, Catholic Church, Fiction, Action and adventure fiction, papacy, suspense fiction, thrillers, signs and symbols, secret societies, anti-Catholicism, Illuminati, vendetta, crimes against physicists, religious educators, popes, election, suspense, Anticatolicismo, Cryptographers, Papas, Physicists, Símbolos, Educadores religiosos, Vendeta, Sociedades secretas, Físicos, Crimes against, Elección, Adventure stories, Delitos contra, Sante sede, Novela de suspense, Ficción, Adventure fiction, Signos y símbolos, Reading Level-Grade 7, Reading Level-Grade 9, Reading Level-Grade 8, Reading Level-Grade 11, Reading Level-Grade 10, Reading Level-Grade 12, Detective and mystery stories, American fiction, Verschwörung, Appreciation, Geheimbund, Art appreciation, FICTION / Thrillers / General, FICTION / Thrillers / Suspense, Fiction, suspense, Vatican city, fiction, Langdon, robert (fictitious character), fiction, Fiction, thrillers, general, Educators, American literature, Langdon, Robert (Personnage fictif), Romans, Sociétés secrètes, Papes, Église catholique, Illuminés, Élection, Roman policier américain, Large type books, nyt:mass-market-paperback=2009-02-22, New York Times bestseller, Fiction, thrillers, suspense, Translations into Serbian, Motion pictures, united states, Fictional Works, Papauté, Romans, nouvelles, American drama, collectionid:dbrl","Angels & demons Dan Brown heparin, ambigrams, antimatter, Freemasons, Swiss Guard, Murder, Investigation, Women scientists, College teachers, Terrorism, Catholic Church, Fiction, Action and adventure fiction, papacy, suspense fiction, thrillers, signs and symbols, secret societies, anti-Catholicism, Illuminati, vendetta, crimes against physicists, religious educators, popes, election, suspense, Anticatolicismo, Cryptographers, Papas, Physicists, Símbolos, Educadores religiosos, Vendeta, Sociedades secretas, Físicos, Crimes against, Elección, Adventure stories, Delitos contra, Sante sede, Novela de suspense, Ficción, Adventure fiction, Signos y símbolos, Reading Level-Grade 7, Reading Level-Grade 9, Reading Level-Grade 8, Reading Level-Grade 11, Reading Level-Grade 10, Reading Level-Grade 12, Detective and mystery stories, American fiction, Verschwörung, Appreciation, Geheimbund, Art appreciation, FICTION / Thrillers / General, FICTION / Thrillers / Suspense, Fiction, suspense, Vatican city, fiction, Langdon, robert (fictitious character), fiction, Fiction, thrillers, general, Educators, American literature, Langdon, Robert (Personnage fictif), Romans, Sociétés secrètes, Papes, Église catholique, Illuminés, Élection, Roman policier américain, Large type books, nyt:mass-market-paperback=2009-02-22, New York Times bestseller, Fiction, thrillers, suspense, Translations into Serbian, Motion pictures, united states, Fictional Works, Papauté, Romans, nouvelles, American drama, collectionid:dbrl",
0671635212,Dream Walker,Marten,,,Dream Walker Marten,Dream Walker may refer to:
0676973094,Stanley Park,Timothy L. Taylor,,"Restaurateurs, Fiction, Vancouver (B.C.), Cookery, Restaurants, Vancouver (b.c.), fiction, Fiction, mystery & detective, general, Cooking","Stanley Park Timothy L. Taylor Restaurateurs, Fiction, Vancouver (B.C.), Cookery, Restaurants, Vancouver (b.c.), fiction, Fiction, mystery & detective, general, Cooking","Stanley Park is a 405-hectare (1,001-acre) public park in British Columbia, Canada, that makes up the northwestern half of Vancouver's Downtown peninsula, surrounded by waters of Burrard Inlet and English Bay. The park borders the neighbourhoods of West End and Coal Harbour to its southeast, and is connected to the North Shore via the Lions Gate Bridge. The historic lighthouse on Brockton Point marks the park's easternmost point."
0679730753,The New Gothic,"Bradford Morrow, McGrath, Patrick",,"American Horror tales, English Horror tales, Horror, Fiction, Gothic fiction, Gothic revival (Literature)","The New Gothic Bradford Morrow, McGrath, Patrick American Horror tales, English Horror tales, Horror, Fiction, Gothic fiction, Gothic revival (Literature)",
0679745203,The  English patient,Michael Ondaatje,,"Fiction, World War, 1939-1945, Ficción, War stories, Historical fiction, Guerra Mundial II, 1939-1945, American literature, Romans, nouvelles, Guerre mondiale, 1939-1945, World War (1939-1945) fast (OCoLC)fst01180924, Canadian fiction, Weltkrieg, Large type books, Italy, fiction, Fiction, historical, World war, 1939-1945, fiction, Fiction, war & military, Novela canadiense, Fiction, historical, general, Fiction, general","The  English patient Michael Ondaatje Fiction, World War, 1939-1945, Ficción, War stories, Historical fiction, Guerra Mundial II, 1939-1945, American literature, Romans, nouvelles, Guerre mondiale, 1939-1945, World War (1939-1945) fast (OCoLC)fst01180924, Canadian fiction, Weltkrieg, Large type books, Italy, fiction, Fiction, historical, World war, 1939-1945, fiction, Fiction, war & military, Novela canadiense, Fiction, historical, general, Fiction, general",
0679781587,Memoirs of a geisha,"Arthur Golden, Arthur Golden, Arthur Golden",,"Social life and customs, Literature, Open Library Staff Picks, Prostitution, Fiction, Historical fiction, Geishas, Women, History, Fictional Works Publication Type, Japan, Historia, Mujeres, Ficción, Japan, fiction, Fiction, historical, Large type books, Fiction, historical, general, Social conditions, Reading Level-Grade 11, Reading Level-Grade 12, Mœurs et coutumes, Histoire, Manners and customs, American fiction, Translations into Korean, Korean language materials, Fiction, general, Fictional Works [Publication Type]","Memoirs of a geisha Arthur Golden, Arthur Golden, Arthur Golden Social life and customs, Literature, Open Library Staff Picks, Prostitution, Fiction, Historical fiction, Geishas, Women, History, Fictional Works Publication Type, Japan, Historia, Mujeres, Ficción, Japan, fiction, Fiction, historical, Large type books, Fiction, historical, general, Social conditions, Reading Level-Grade 11, Reading Level-Grade 12, Mœurs et coutumes, Histoire, Manners and customs, American fiction, Translations into Korean, Korean language materials, Fiction, general, Fictional Works [Publication Type]","Memoirs of a Geisha is a historical fiction novel by American author Arthur Golden, published in 1997. The novel, told in first person perspective, tells the story of Nitta Sayuri and the many trials she faces on the path to becoming and working as a geisha in Kyoto, Japan, before, during and after World War II.
In 2005, a film adaptation was released, directed by Rob Marshall and starring Zhang Ziyi in the lead role."
0696006308,Better homes and gardens home canning cook book.,,,"Frozen foods, Canning and preserving","Better homes and gardens home canning cook book.  Frozen foods, Canning and preserving",
0722123019,The World In Winter,"John Christopher, Sam Youd",,"Fiction, science fiction, action & adventure","The World In Winter John Christopher, Sam Youd Fiction, science fiction, action & adventure",
0727847066,Tales of Obsession,,,,Tales of Obsession,
0743418174,Good in Bed,Jodi Picocell,,"Overweight women, Fiction, Women journalists, Young women, Domestic--fiction, Humorous stories, Fiction, romance, contemporary, Philadelphia (pa.), fiction, Women journalists, fiction, Young women, fiction, Fiction, humorous","Good in Bed Jodi Picocell Overweight women, Fiction, Women journalists, Young women, Domestic--fiction, Humorous stories, Fiction, romance, contemporary, Philadelphia (pa.), fiction, Women journalists, fiction, Young women, fiction, Fiction, humorous","Good In Bed  is the debut novel of Jennifer Weiner. It tells the story of an overweight Jewish female journalist, her love and work life and her emotional abuse issues with her father. The novel was a New York Times Best Seller and as of 2020 is being adapted into a film produced by and starring Mindy Kaling for HBO Max."
075640049X,Sword and sorceress XIX,Marion Zimmer Bradley,,"Magic, Women heroes, Wizards, American Fantasy fiction, Fiction, Fiction, fantasy, general","Sword and sorceress XIX Marion Zimmer Bradley Magic, Women heroes, Wizards, American Fantasy fiction, Fiction, Fiction, fantasy, general",
0786883219,Brain droppings,George Carlin,,"American wit and humor, American wit and humor, social life and customs, Comedians","Brain droppings George Carlin American wit and humor, American wit and humor, social life and customs, Comedians",
0804106304,The Joy Luck club.,"Amy Tan, Gwendoline Yeo, Tsai Chin, Ronald Bass, Wayne Wang, Jordi Fibla",,"Chinese American, Chinese American women, Chinese American women in fiction, Chinese Americans, Chinese Americans in fiction, Death, Female friendship, Female friendship in fiction, Fiction, Literature, Loss (Psychology), Mothers, Mothers and daughters, Mothers and daughters in fiction, Mothers in fiction, Reminiscing in old age, Reminiscing in old age in fiction, Societies and clubs, Women, Women in fiction, California, San Francisco (Calif.), Asian Americans, Mother and child, Littérature américaine, Auteurs d'origine chinoise, open_syllabus_project, Reading Level-Grade 11, Reading Level-Grade 10, Reading Level-Grade 12, Fiction, family life, Friendship, fiction, San francisco (calif.), fiction, Mothers and daughters, fiction, Chinese americans, fiction, Fiction, psychological, Large type books, Fiction, family life, general, Fiction, sagas, Fictional Works [Publication Type], Asian American, Literary, Sagas, Autographed books, Ficción, Novela hogareña, Mujeres chino-americanas, Madre e hija, Drama, Chinese American families, Madres e hijas, Novela","The Joy Luck club. Amy Tan, Gwendoline Yeo, Tsai Chin, Ronald Bass, Wayne Wang, Jordi Fibla Chinese American, Chinese American women, Chinese American women in fiction, Chinese Americans, Chinese Americans in fiction, Death, Female friendship, Female friendship in fiction, Fiction, Literature, Loss (Psychology), Mothers, Mothers and daughters, Mothers and daughters in fiction, Mothers in fiction, Reminiscing in old age, Reminiscing in old age in fiction, Societies and clubs, Women, Women in fiction, California, San Francisco (Calif.), Asian Americans, Mother and child, Littérature américaine, Auteurs d'origine chinoise, open_syllabus_project, Reading Level-Grade 11, Reading Level-Grade 10, Reading Level-Grade 12, Fiction, family life, Friendship, fiction, San francisco (calif.), fiction, Mothers and daughters, fiction, Chinese americans, fiction, Fiction, psychological, Large type books, Fiction, family life, general, Fiction, sagas, Fictional Works [Publication Type], Asian American, Literary, Sagas, Autographed books, Ficción, Novela hogareña, Mujeres chino-americanas, Madre e hija, Drama, Chinese American families, Madres e hijas, Novela",
0842329129,Left behind,Tim F. LaHaye,,"Rayford Steele (Fictitious character), Rapture (Christian eschatology), Fiction, Christian fiction, Steele, Rayford (Fictitious character)","Left behind Tim F. LaHaye Rayford Steele (Fictitious character), Rapture (Christian eschatology), Fiction, Christian fiction, Steele, Rayford (Fictitious character)","Left Behind is a multimedia franchise of apocalyptic fiction written by Tim LaHaye and Jerry B. Jenkins, released by Tyndale House Publishers from 1995 to 2007.
The bestselling premillennial novels are Christian eschatological narratives inspired by the New Testament's Book of Revelation. The storyline focuses on a seven-year conflict, the post-rapture Great Tribulation, between an underground network of Christian converts and an oppressive new world order led by the Antichrist."
0949206318,My place,Sally Morgan,,"Social life and customs, Family, Aboriginal Australian Women, Race discrimination, Social conditions, Aboriginal Australians, Biography, Women, Fiction, general, Autobiography and memoir, Australian indigenous studies, New York Times reviewed, Women, biography, Women, australia, Australia, social life and customs, Australia, social conditions, Australia, biography, Aboriginal australians, biography, Sex (Psychology), Mixed descent","My place Sally Morgan Social life and customs, Family, Aboriginal Australian Women, Race discrimination, Social conditions, Aboriginal Australians, Biography, Women, Fiction, general, Autobiography and memoir, Australian indigenous studies, New York Times reviewed, Women, biography, Women, australia, Australia, social life and customs, Australia, social conditions, Australia, biography, Aboriginal australians, biography, Sex (Psychology), Mixed descent",
0968657400,Christmas Eve Can Kill You,Bill Marantz,,,Christmas Eve Can Kill You Bill Marantz,
0971880107,Wild animus,Rich Shapero,,"Fiction, Spiritual life, Metaphysics, Adventure fiction, Animals, Adventure stories, Drug abuse, LSD (Drug), Man-woman relationship, Fiction, general, Alaska, fiction","Wild animus Rich Shapero Fiction, Spiritual life, Metaphysics, Adventure fiction, Animals, Adventure stories, Drug abuse, LSD (Drug), Man-woman relationship, Fiction, general, Alaska, fiction",
1551920778,,,,,,Nan or NAN may refer to:
1580083234,Doggy days,Joe Borgenicht,,"Handicraft, Equipment and supplies, Dogs, Exercise","Doggy days Joe Borgenicht Handicraft, Equipment and supplies, Dogs, Exercise",
1858681006,Mensa Mighty Mindbenders,Mensa Publication,,,Mensa Mighty Mindbenders Mensa Publication,
1883011469,Crime novels,"Cornell Woolrich, Horace McCoy, James M. Cain, Kenneth Fearing, Edward Anderson, William Lindsay Gresham",,"American Detective and mystery stories, Crime, American fiction, Fiction, Detective and mystery stories, American Noir fiction, American fiction (collections), 20th century, Detective and mystery stories, american, Noir fiction, american","Crime novels Cornell Woolrich, Horace McCoy, James M. Cain, Kenneth Fearing, Edward Anderson, William Lindsay Gresham American Detective and mystery stories, Crime, American fiction, Fiction, Detective and mystery stories, American Noir fiction, American fiction (collections), 20th century, Detective and mystery stories, american, Noir fiction, american","Crime fiction, detective story, murder mystery, crime novel, mystery novel, and police novel are terms used to describe narratives or fiction that centre on criminal acts and especially on the investigation, either by an amateur or a professional detective, of a crime, often a murder. Most crime drama focuses on criminal investigation and does not feature the courtroom. Suspense and mystery are key elements that are nearly ubiquitous to the genre."
8401491509,Peligro inminente,Tom Clancy,,"Clark, john (fictitious character), fiction, Ryan, jack (fictitious character), fiction, South america, fiction, Washington (d.c.), fiction, Fiction, action & adventure, Fiction, espionage, Fiction, thrillers, general, Fiction, thrillers, espionage, Fiction, Intelligence service, Jack Ryan (Fictitious character), American Suspense fiction, John Clark (Fictitious character), Spy stories, New York Times reviewed, drugs, Open Library Staff Picks, Spies, Jack Ryan (Fictional character), Fictional Works, Large type books, Sr. Ryan, Jack (Fictitious character), Belletristische Darstellung, Drogenkriminalität, Innere Sicherheit, Spanish language, Spanish fiction, FICTION / Action & Adventure","Peligro inminente Tom Clancy Clark, john (fictitious character), fiction, Ryan, jack (fictitious character), fiction, South america, fiction, Washington (d.c.), fiction, Fiction, action & adventure, Fiction, espionage, Fiction, thrillers, general, Fiction, thrillers, espionage, Fiction, Intelligence service, Jack Ryan (Fictitious character), American Suspense fiction, John Clark (Fictitious character), Spy stories, New York Times reviewed, drugs, Open Library Staff Picks, Spies, Jack Ryan (Fictional character), Fictional Works, Large type books, Sr. Ryan, Jack (Fictitious character), Belletristische Darstellung, Drogenkriminalität, Innere Sicherheit, Spanish language, Spanish fiction, FICTION / Action & Adventure",
8472236552,Un viejo que leía novelas de amor,Luis Sepúlveda,,"Fiction, general, Fiction (fictional works by one author), Continental european fiction (fictional works by one author)","Un viejo que leía novelas de amor Luis Sepúlveda Fiction, general, Fiction (fictional works by one author), Continental european fiction (fictional works by one author)",
8483007959,JOCS DE NIT,Raj Kamal Jha,,,JOCS DE NIT Raj Kamal Jha,
8825609655,,,,,,Nan or NAN may refer to:
8872261872,Cazzi vostri. Io domani vado in Svizzera,Gian marco Chiavari,,,Cazzi vostri. Io domani vado in Svizzera Gian marco Chiavari,
8882548597,,,,,,Nan or NAN may refer to:
9510195928,,,,,,Nan or NAN may refer to:
9879738705,,,,,,Nan or NAN may refer to:
0440200040,Pale kings and princes,Robert B. Parker,,"Private investigators, Spenser (Fictitious character), Fiction, Fiction, mystery & detective, hard-boiled, Spenser (fictitious character), fiction, Massachusetts, fiction, Boston (mass.), fiction, Drug abuse, Prevention","Pale kings and princes Robert B. Parker Private investigators, Spenser (Fictitious character), Fiction, Fiction, mystery & detective, hard-boiled, Spenser (fictitious character), fiction, Massachusetts, fiction, Boston (mass.), fiction, Drug abuse, Prevention","Pale Kings and Princes is a Spenser novel by Robert B. Parker. The title is taken from John Keats's poem La Belle Dame sans Merci: A Ballad. Following the murder of a reporter, Spenser is hired by a newspaper to investigate drug smuggling around the area of Wheaton, Massachusetts."
0486261794,Self-working coin magic,Karl Fulves,,Coin tricks,Self-working coin magic Karl Fulves Coin tricks,
0590401939,You Be the Jury,Marvin Miller,,"Detective and mystery stories, Mystery and detective stories, Children's fiction","You Be the Jury Marvin Miller Detective and mystery stories, Mystery and detective stories, Children's fiction",
