isbn,title,authors,description,subjects,text,wiki_description
1890862150,Lonesome Song (Shep Harrington Small Town Mysteries),Elliott Light,,,Lonesome Song (Shep Harrington Small Town Mysteries) Elliott Light,
0060168196,How to bake,Nick Malgieri,,Baking,How to bake Nick Malgieri Baking,
038071681X,Ghost girl,Torey L. Hayden,,"Mental health, Abused children, Psychology, Psychopathologie, Rituals, Cas, Études de, Satanism, Case studies, Psychological aspects of Satanism, Mentally ill children, Psychological aspects, Child psychotherapy, Enfants, Enfants maltraités","Ghost girl Torey L. Hayden Mental health, Abused children, Psychology, Psychopathologie, Rituals, Cas, Études de, Satanism, Case studies, Psychological aspects of Satanism, Mentally ill children, Psychological aspects, Child psychotherapy, Enfants, Enfants maltraités",
0884949710,When life doesn't seem fair,Bruce Erickson,,"Mormons, Children with disabilities, Consolation, Family relationships, Mormon authors, Christian life, Biography, Conduct of life","When life doesn't seem fair Bruce Erickson Mormons, Children with disabilities, Consolation, Family relationships, Mormon authors, Christian life, Biography, Conduct of life",
1561732354,Treasury of Christmas Recipe Collection,,,"Christmas cooking, American Cooking","Treasury of Christmas Recipe Collection  Christmas cooking, American Cooking",
1840382325,Pract Ency Cakes & Cake Decorati,Joanna Lorenz,,"Cake, Cake decorating","Pract Ency Cakes & Cake Decorati Joanna Lorenz Cake, Cake decorating",
0020960808,The natural superiority of women.,Ashley Montagu,,"Feminism, Psychological aspects, Psychological aspects of Feminism, Psychology, Sex role, Woman, Women, Femmes, Social conditions, Vrouwen, Gelijkheid, Women, psychology, Feminist theory, Physical anthropology, Gender identity, Geschlechterrolle, Frau","The natural superiority of women. Ashley Montagu Feminism, Psychological aspects, Psychological aspects of Feminism, Psychology, Sex role, Woman, Women, Femmes, Social conditions, Vrouwen, Gelijkheid, Women, psychology, Feminist theory, Physical anthropology, Gender identity, Geschlechterrolle, Frau",
006019040X,Esau,Meir Shalev,,"Israel, fiction","Esau Meir Shalev Israel, fiction","Esau is the elder son of Isaac in the Hebrew Bible. He is mentioned in the Book of Genesis and by the prophets Obadiah and Malachi. The story of Jacob and Esau reflects the historical relationship between Israel and Edom, aiming to explain why Israel, despite being a younger kingdom, dominated Edom."
0060250631,Addie meets Max,"Robins, Joan.",,"Fiction, Friendship, Children's fiction, Friendship, fiction","Addie meets Max Robins, Joan. Fiction, Friendship, Children's fiction, Friendship, fiction",
0307160289,The Saggy Baggy Elephant,"Kathryn Jackson, Byron Jackson, Gustaf Tenggren",,"Animals, Fiction, Board books, Jungle animals, Elephants, Self-acceptance, Elephants in fiction, Jungle animals in fiction, Self-acceptance in fiction, Animals in fiction, Children's fiction, Elephants, fiction, Self-acceptance, fiction, Jungle animals, fiction","The Saggy Baggy Elephant Kathryn Jackson, Byron Jackson, Gustaf Tenggren Animals, Fiction, Board books, Jungle animals, Elephants, Self-acceptance, Elephants in fiction, Jungle animals in fiction, Self-acceptance in fiction, Animals in fiction, Children's fiction, Elephants, fiction, Self-acceptance, fiction, Jungle animals, fiction","The Little Golden Books is an American series of children's books, published since 1942.  The Poky Little Puppy, the eighth release in the series, is the top-selling children's book of all time in the United States. Many other Little Golden Books have become bestsellers, including Tootle, Scuffy the Tugboat, The Little Red Hen, and Doctor Dan the Bandage Man."
0385189524,The  City of Joy,Dominique Lapierre,,"Altruism, Conduct of life, Description and travel, Poor, Refugees, Social conditions, Calcutta (India), Travel, Fiction, general, Large type books, Poor, india, India, social conditions, Pauvreté, Inde, Pauvres, Conditions sociales, Oeuvres de bienfaisance, Histoire, Bidonville, Anand Nagar, NOVELAS FRANCESAS, Condiciones sociales, Conducta (Ética), Refugiados, Descripciones y viajes, Altruismo, Refugees, india","The  City of Joy Dominique Lapierre Altruism, Conduct of life, Description and travel, Poor, Refugees, Social conditions, Calcutta (India), Travel, Fiction, general, Large type books, Poor, india, India, social conditions, Pauvreté, Inde, Pauvres, Conditions sociales, Oeuvres de bienfaisance, Histoire, Bidonville, Anand Nagar, NOVELAS FRANCESAS, Condiciones sociales, Conducta (Ética), Refugiados, Descripciones y viajes, Altruismo, Refugees, india","Kolkata, also known as Calcutta (its official name until 2001), is the capital and largest city of the Indian state of West Bengal. It lies on the eastern bank of the Hooghly River, 80 km (50 mi) west of the border with Bangladesh. It is the primary financial and commercial centre of eastern and northeastern India."
0307701026,The Golden Book Encyclopedia,Western Publishing Company,,"Encyclopedias and dictionaries, Children's encyclopedias and dictionaries","The Golden Book Encyclopedia Western Publishing Company Encyclopedias and dictionaries, Children's encyclopedias and dictionaries",
0373012624,"House of the Winds (Harlequin Romance, 1262)",Roumelia Lane,,,"House of the Winds (Harlequin Romance, 1262) Roumelia Lane",
0373026692,Tormented Rhapsody,Donna Baker,,"Fiction, romance, general","Tormented Rhapsody Donna Baker Fiction, romance, general",
0373030282,Jinxed,Day Leclaire,,"Fiction, general","Jinxed Day Leclaire Fiction, general",A jinx is a condition of bad luck possibly by way of a curse.
0373106750,The Failed Marriage,Carole Mortimer,,"Fiction, Romance, Contemporary"", Death, fiction, Grief and loss, fictuon, Marriage, fiction","The Failed Marriage Carole Mortimer Fiction, Romance, Contemporary"", Death, fiction, Grief and loss, fictuon, Marriage, fiction",
0373107544,Intimate,Donna Huxley,,"Fiction, Romance, Contemporary","Intimate Donna Huxley Fiction, Romance, Contemporary","Intimate may refer to:

Intimate examination, a physical examination for medical purposes that includes examination of the breasts, genitalia, or rectum of a patient
Intimate ion pair, the interactions between a cation, anion and surrounding solvent molecules
Intimate media, media artifacts created and collected to capture and commemorate aspects of family and intimate relationships
Intimate part, a place on the human body which it is usually customary to keep covered with clothing in public areas
Intimate relationship, a particularly close interpersonal relationship
Intimate second-person pronouns in languages with a T–V distinction."
037329171X,The Widow's Little Secret,Judith Stacy,,"Fiction, Romance, Historical, Western","The Widow's Little Secret Judith Stacy Fiction, Romance, Historical, Western",
0440190827,Two of a kind,Lori Copeland,,,Two of a kind Lori Copeland,
0670804673,The story of English,Robert McCrum,,"English language, History, Engels, Histoire, Anglais (Langue), Geschichte, Literatur, Englisch, English language, history, Dickens, charles, 1812-1870, Language arts & disciplines, Germanic languages - english language, Historical  linguistics, Criticism and interpretation","The story of English Robert McCrum English language, History, Engels, Histoire, Anglais (Langue), Geschichte, Literatur, Englisch, English language, history, Dickens, charles, 1812-1870, Language arts & disciplines, Germanic languages - english language, Historical  linguistics, Criticism and interpretation",
0671533800,Endless Summer,Rose Bayner,,,Endless Summer Rose Bayner,Endless Summer or The Endless Summer may refer to:
0373257775,Manhunting in Montana ( Manhunting...),Vicki Lewis Thompson,,"Fiction, romance, contemporary, Fiction, romance, general","Manhunting in Montana ( Manhunting...) Vicki Lewis Thompson Fiction, romance, contemporary, Fiction, romance, general",
0373762364,Secret Baby Santos (Secrets),Barbara McCauley,,"Women journalists, Single mothers, Motorcycle racing, Fiction, Fiction, romance, contemporary, Fiction, romance, erotica, Fiction, romance, erotic","Secret Baby Santos (Secrets) Barbara McCauley Women journalists, Single mothers, Motorcycle racing, Fiction, Fiction, romance, contemporary, Fiction, romance, erotica, Fiction, romance, erotic",
0439194253,Franklin in the dark,"Paulette Bourgeois, Brenda Clark, Bonnie Bader",,"Children's fiction, Franklin (fictitious character : bourgeois), fiction, Turtles, fiction, Fear, fiction, Toy and movable books, Novela juvenil, Animals, Turtles, Readers, Juvenile fiction, Readers (Primary), Fiction, Fear of the dark, Animales, Fear, Spanish language materials, Franklin (Fictitious character : Bourgeois), Literature and fiction, juvenile, Juvenile literature, Benjamin (Personnage fictif : Bourgeois), Ouvrages pour la jeunesse, Picture books, Franklin (Fictitious character), Peur, Ouvrages illustrés, Nuit, Tortues, Animaux, Polish language materials","Franklin in the dark Paulette Bourgeois, Brenda Clark, Bonnie Bader Children's fiction, Franklin (fictitious character : bourgeois), fiction, Turtles, fiction, Fear, fiction, Toy and movable books, Novela juvenil, Animals, Turtles, Readers, Juvenile fiction, Readers (Primary), Fiction, Fear of the dark, Animales, Fear, Spanish language materials, Franklin (Fictitious character : Bourgeois), Literature and fiction, juvenile, Juvenile literature, Benjamin (Personnage fictif : Bourgeois), Ouvrages pour la jeunesse, Picture books, Franklin (Fictitious character), Peur, Ouvrages illustrés, Nuit, Tortues, Animaux, Polish language materials",
0553250787,The Red Rocket #11,Seth McEvoy,,,The Red Rocket #11 Seth McEvoy,
0802784666,How to babysit an orangutan,"Tara Darling, Tara Darling-Lyon",,"Orangutan, Infancy, Juvenile literature, Reintroduction, Animals, Wildlife reintroduction, Wildlife conservation, Orangutans","How to babysit an orangutan Tara Darling, Tara Darling-Lyon Orangutan, Infancy, Juvenile literature, Reintroduction, Animals, Wildlife reintroduction, Wildlife conservation, Orangutans",
1588650146,Never give up,,,"Conduct of life, Determination (Personality trait)","Never give up  Conduct of life, Determination (Personality trait)",
0380800675,The Resurrectionist,Mark Graham,,"Mccleary, wilton (fictitious character), fiction, Fiction, mystery & detective, police procedural, Fiction, historical, general, Philadelphia (pa.), fiction, Pennsylvania, fiction","The Resurrectionist Mark Graham Mccleary, wilton (fictitious character), fiction, Fiction, mystery & detective, police procedural, Fiction, historical, general, Philadelphia (pa.), fiction, Pennsylvania, fiction",The Resurrectionist may refer to:
0816515484,El Milagro and Other Stories,Patricia Preciado Martin,,"Fiction, Mexican American women, Mexican Americans, Social life and customs, Hispanic American authors, Mexican American authors, Women authors, Hispanic American women authors, Mexican American women authors, Fiction, short stories (single author), Arizona, fiction, Mexican americans, fiction, Hispanic american literature (spanish), history and criticism","El Milagro and Other Stories Patricia Preciado Martin Fiction, Mexican American women, Mexican Americans, Social life and customs, Hispanic American authors, Mexican American authors, Women authors, Hispanic American women authors, Mexican American women authors, Fiction, short stories (single author), Arizona, fiction, Mexican americans, fiction, Hispanic american literature (spanish), history and criticism",
092996814X,Earthly justice,E. S. Goldman,,,Earthly justice E. S. Goldman,
044021162X,Close Quarters (Nina Fischman Mystery),Marissa Piesman,,"Fischman, nina (fictitious character), fiction, Fiction, mystery & detective, women sleuths, New york (n.y.), fiction, Women lawyers, fiction","Close Quarters (Nina Fischman Mystery) Marissa Piesman Fischman, nina (fictitious character), fiction, Fiction, mystery & detective, women sleuths, New york (n.y.), fiction, Women lawyers, fiction",
0754003388,That Was Then (Home Repair Is Homicide Mysteries) (Home Repair Is Homicide Mysteries),Sarah Harrison,,,That Was Then (Home Repair Is Homicide Mysteries) (Home Repair Is Homicide Mysteries) Sarah Harrison,
0140363726,Your mother was a Neanderthal,"Jon Scieszka, Lane Smith",,"Fiction, Humorous stories, Juvenile fiction, Prehistoric peoples, Time travel, Children's fiction, Time travel, fiction, Prehistoric peoples, fiction, Stone age, fiction","Your mother was a Neanderthal Jon Scieszka, Lane Smith Fiction, Humorous stories, Juvenile fiction, Prehistoric peoples, Time travel, Children's fiction, Time travel, fiction, Prehistoric peoples, fiction, Stone age, fiction",
0965818306,Defenders of the Nation,Helen S. Konz,,,Defenders of the Nation Helen S. Konz,
0821724797,Lone Star surrender,Carol Finch,,Fiction,Lone Star surrender Carol Finch Fiction,
0821738453,Texas Touch,Emma Merritt,,"collectionID:Wbodice_ripper, Fiction, Romance, Historical, Fiction, romance, western, Bodice Ripper","Texas Touch Emma Merritt collectionID:Wbodice_ripper, Fiction, Romance, Historical, Fiction, romance, western, Bodice Ripper",
0441778127,The specialist,Gayle Rivers,,"Terrorism, Assassins, Biography, Prevention, Politischer Mord, USA, Regierung, USA Government, Assassination, Fiction, general","The specialist Gayle Rivers Terrorism, Assassins, Biography, Prevention, Politischer Mord, USA, Regierung, USA Government, Assassination, Fiction, general",
0843950676,Texas bride,Leigh Greenwood,,Western stories,Texas bride Leigh Greenwood Western stories,
0028641736,Macmillian Teach Yourself French in 24 Hours,William Griffin,,"French language, Textbooks for foreign speakers, English, French language, textbooks for foreign speakers","Macmillian Teach Yourself French in 24 Hours William Griffin French language, Textbooks for foreign speakers, English, French language, textbooks for foreign speakers",
0373099320,Ring And A Promise,Andrea Edwards,,"Fiction, romance, general","Ring And A Promise Andrea Edwards Fiction, romance, general",
0373119291,Marriage To Remember (Top Author),Carole Mortimer,,"Fiction, Romance, Contemporary, Married people, fiction, Marriage, fiction, Billionaires, fiction, Romantic comedy, fiction","Marriage To Remember (Top Author) Carole Mortimer Fiction, Romance, Contemporary, Married people, fiction, Marriage, fiction, Billionaires, fiction, Romantic comedy, fiction",
0671736256,The Scarlet Temptress,Sue Rich,,"Historical Love stories, Fiction, History, Historical Romance, Fiction, romance, historical, general","The Scarlet Temptress Sue Rich Historical Love stories, Fiction, History, Historical Romance, Fiction, romance, historical, general",
0812558006,Firechild,Jack Williamson,,"Science fiction, Fiction, science fiction, general","Firechild Jack Williamson Science fiction, Fiction, science fiction, general",
0821758594,No choice but surrender,Meagan McKinney,,"collectionID:bodice_ripper, Large type books, History, Fiction, Fiction, romance, general","No choice but surrender Meagan McKinney collectionID:bodice_ripper, Large type books, History, Fiction, Fiction, romance, general",
0553204998,Lensman from Rigel,David A. Kyle,,,Lensman from Rigel David A. Kyle,
188443004X,Digging Deeper,Joseph Kiefer,,"Community gardens, Children's gardens","Digging Deeper Joseph Kiefer Community gardens, Children's gardens",
084233498X,Leota's garden,Francine Rivers,,"Literature, Fiction","Leota's garden Francine Rivers Literature, Fiction",
0140084460,The Salterton trilogy,Robertson Davies,,"Canadian Didactic fiction, Authors, Canadian (English), Fiction, historical, general, American fiction (fictional works by one author), Fiction, general, Fiction, Social life and customs","The Salterton trilogy Robertson Davies Canadian Didactic fiction, Authors, Canadian (English), Fiction, historical, general, American fiction (fictional works by one author), Fiction, general, Fiction, Social life and customs",
0399144420,Three complete novels,Dean Koontz,,"Fiction, horror","Three complete novels Dean Koontz Fiction, horror",
0684845601,Obsession,"John E. Douglas, Mark Olshaker",,"Psychology, Serial murders, Self-defense, Sex offenders, Case studies, Serial murder investigation, Serial murderers, Victims of crimes, Homicide investigation, Criminal psychology, Crime, united states","Obsession John E. Douglas, Mark Olshaker Psychology, Serial murders, Self-defense, Sex offenders, Case studies, Serial murder investigation, Serial murderers, Victims of crimes, Homicide investigation, Criminal psychology, Crime, united states",Obsession may refer to:
0140232605,,,,,,Nan or NAN may refer to:
0312922159,"How to Win at Nintendo Games, # 3",Jeff Rovin,,"Video games, Videogames, Games, Strategy, Puzzles, Passtimes, Hobbies, Nintendo Entertainment System, NES, Nintendō Kabushiki Kaisha, Handbooks, manuals, Nintendo video games","How to Win at Nintendo Games, # 3 Jeff Rovin Video games, Videogames, Games, Strategy, Puzzles, Passtimes, Hobbies, Nintendo Entertainment System, NES, Nintendō Kabushiki Kaisha, Handbooks, manuals, Nintendo video games",
0373074565,From A Distance,Emilie Richards,,"Fiction, romance, contemporary","From A Distance Emilie Richards Fiction, romance, contemporary","""From a Distance"" is a song by American singer-songwriter Julie Gold, initially penned in 1985. Gold's friend Christine Lavin introduced the song to Nanci Griffith, who first recorded it for her 1987 album Lone Star State of Mind. A successful cover version by Bette Midler was released in 1990."
0373097697,Love,Sherryl Woods,,,Love Sherryl Woods,"Love is a feeling of strong attraction and emotional attachment to a person, animal, or thing. It is expressed in many forms, encompassing a range of strong and positive emotional and mental states, from the most sublime virtue or good habit, or the deepest interpersonal affection, to the simplest pleasure. An example of this range of meanings is that the love of a mother differs from the love of a spouse, which differs from the love of food."
0373821662,Joey's Father,Elizabeth August,,,Joey's Father Elizabeth August,
0590438107,My face to the wind,"Murphy, Jim",,"Juvenile fiction, Fiction, Diaries, Teachers, Orphans, Self-reliance, City and town life, History, Children's fiction, Teachers, fiction, Orphans, fiction, Nebraska, fiction","My face to the wind Murphy, Jim Juvenile fiction, Fiction, Diaries, Teachers, Orphans, Self-reliance, City and town life, History, Children's fiction, Teachers, fiction, Orphans, fiction, Nebraska, fiction",
068480283X,Parker's wine buyer's guide,"Robert M. Parker, Jr.",,"Wine and wine making, Wine and wine making., Wine and wine making, dictionaries","Parker's wine buyer's guide Robert M. Parker, Jr. Wine and wine making, Wine and wine making., Wine and wine making, dictionaries",
0785310363,Christmas Fun for Kids (TupperKids) (Stories Crafts Songs and More),,,,Christmas Fun for Kids (TupperKids) (Stories Crafts Songs and More),
0874068266,Snakes alive!,"Janet Lambert, Ray Keane",,"Juvenile literature, Snakes, Nature, Nature/Ecology, Children's All Ages, NAT028000, NAT, Animals - Reptiles & Amphibians, Reptiles & Amphibians","Snakes alive! Janet Lambert, Ray Keane Juvenile literature, Snakes, Nature, Nature/Ecology, Children's All Ages, NAT028000, NAT, Animals - Reptiles & Amphibians, Reptiles & Amphibians",
1557739501,Fatal instinct,Robert W. Walker,,"Women medical scientists, Medical examiners (Law), Serial murders, Fiction, Fiction, psychological, Coran, jessica (fictitious character), fiction, Fiction, mystery & detective, women sleuths, Washington (d.c.), fiction, Forensic pathologists, fiction","Fatal instinct Robert W. Walker Women medical scientists, Medical examiners (Law), Serial murders, Fiction, Fiction, psychological, Coran, jessica (fictitious character), fiction, Fiction, mystery & detective, women sleuths, Washington (d.c.), fiction, Forensic pathologists, fiction",
1561561452,How To Draw Trucks,,,"Drawing, juvenile literature, Drawing, technique","How To Draw Trucks  Drawing, juvenile literature, Drawing, technique",
1561565504,Sea Creatures (A-MAZE-MENT PARK),,,,Sea Creatures (A-MAZE-MENT PARK),
1576600122,Investing in small-cap stocks,Christopher Graja,,"Small capitalization stocks, Stocks, Investments","Investing in small-cap stocks Christopher Graja Small capitalization stocks, Stocks, Investments",
1586609726,To catch a thief,Carol Cox,,"Train robberies, Women detectives, Women authors, American fiction, American Romance fiction, Pinkerton's National Detective Agency, American Detective and mystery stories, Fiction, Fiction, mystery & detective, women sleuths","To catch a thief Carol Cox Train robberies, Women detectives, Women authors, American fiction, American Romance fiction, Pinkerton's National Detective Agency, American Detective and mystery stories, Fiction, Fiction, mystery & detective, women sleuths",
399111069,,,,,,Nan or NAN may refer to:
031225329X,The ladies of Covington send their love,Joan A. Medlicott,,"Retired women, Older women, Boardinghouses in fiction, Retirees in fiction, Older women in fiction, Fiction, North Carolina in fiction, Boardinghouses, Retired women in fiction, Female friendship, Female friendship in fiction, Domestic fiction, Retirees, Large type books, Fiction, general, Friendship, fiction, North carolina, fiction","The ladies of Covington send their love Joan A. Medlicott Retired women, Older women, Boardinghouses in fiction, Retirees in fiction, Older women in fiction, Fiction, North Carolina in fiction, Boardinghouses, Retired women in fiction, Female friendship, Female friendship in fiction, Domestic fiction, Retirees, Large type books, Fiction, general, Friendship, fiction, North carolina, fiction",
1576730336,Under the distant sky,Al Lacy,,"Fiction, Women pioneers","Under the distant sky Al Lacy Fiction, Women pioneers",
0263817075,"The Regency Collection, Vol. 1","Paula Marshall, Sarah Westleigh",,"Fiction, Romance, Historical, Regency, Great Britain fiction, English Romance fiction, Anthology, Great britain, fiction, Fiction, romance, general","The Regency Collection, Vol. 1 Paula Marshall, Sarah Westleigh Fiction, Romance, Historical, Regency, Great Britain fiction, English Romance fiction, Anthology, Great britain, fiction, Fiction, romance, general",
037324231X,Dream Bride,Susan Mallery,,"Fiction, romance, general","Dream Bride Susan Mallery Fiction, romance, general",
0373592787,Jake's Angel,K. Freiman,,"Fiction, general","Jake's Angel K. Freiman Fiction, general",
0373095589,Twice Shy,Victoria Pade,,,Twice Shy Victoria Pade,Twice Shy may refer to:
0373096585,Step From A Dream,Judi Edwards,,"Fiction, romance, general","Step From A Dream Judi Edwards Fiction, romance, general",
0451403045,Double Down,Tom Kakonis,,"Gambling, Poker, Fiction, Fiction, thrillers, espionage","Double Down Tom Kakonis Gambling, Poker, Fiction, Fiction, thrillers, espionage",Double down is a betting technique in blackjack.
0786905204,Stormlight,Ed Greenwood,,Fantasy,Stormlight Ed Greenwood Fantasy,"The Stormlight Archive is a high fantasy novel series written by American author Brandon Sanderson, planned to consist of ten novels. As of 2024, the series comprises five published novels and two novellas, set within his broader Cosmere universe. The first novel, The Way of Kings, was published on August 31, 2010."
0821735500,Midnight safari,Ann Lynn,,,Midnight safari Ann Lynn,
0060932627,Spadework,Timothy Findley,,"Theater, Actors, Stratford Festival (Ont.), Fiction, Ontario, fiction, Actors, fiction, Fiction, romance, contemporary, Stratford Festival (Ontario) fast (OCoLC)fst01410664, Romans, nouvelles, Théâtre, Acteurs","Spadework Timothy Findley Theater, Actors, Stratford Festival (Ont.), Fiction, Ontario, fiction, Actors, fiction, Fiction, romance, contemporary, Stratford Festival (Ontario) fast (OCoLC)fst01410664, Romans, nouvelles, Théâtre, Acteurs","Spadework is a novel by Canadian writer Timothy Findley set in the theater world of Stratford, Ontario. It was first published in Canada by HarperCollins Publishers in 2001."
0312980205,Never Count Out the Dead (St. Martin's Minotaur Mysteries),Boston Teran,,"Fiction, thrillers, suspense, Los angeles (calif.), fiction, Missing persons, fiction","Never Count Out the Dead (St. Martin's Minotaur Mysteries) Boston Teran Fiction, thrillers, suspense, Los angeles (calif.), fiction, Missing persons, fiction",
0393303756,The flamingo's smile,Stephen Jay Gould,,"Addresses, essays, lectures, Natural history, Biologie, Evolutie, Paleontologie, Geologie, Dierkunde, Aufsatzsammlung, Science, Miscellanea, Natural selection, History, Evolution, Essays","The flamingo's smile Stephen Jay Gould Addresses, essays, lectures, Natural history, Biologie, Evolutie, Paleontologie, Geologie, Dierkunde, Aufsatzsammlung, Science, Miscellanea, Natural selection, History, Evolution, Essays",
0590734245,The complete Booky,Bernice Thurman Hunter,,"Juvenile fiction, Children's stories, Canadian, Depressions","The complete Booky Bernice Thurman Hunter Juvenile fiction, Children's stories, Canadian, Depressions",
0671550500,The last vampire 5,Christopher Pike,,"Juvenile fiction, Alisa Perne (Fictitious character), Vampires, Children's fiction, Horror stories, Fiction, Supernatural, Fantasy fiction","The last vampire 5 Christopher Pike Juvenile fiction, Alisa Perne (Fictitious character), Vampires, Children's fiction, Horror stories, Fiction, Supernatural, Fantasy fiction",
074972711X,After the Plague (Contents),Jean Ure,,"Children's fiction, Adventure and adventurers, fiction","After the Plague (Contents) Jean Ure Children's fiction, Adventure and adventurers, fiction",
