isbn,title,authors,description,subjects,text,wiki_description
0553279556,"""E"" is for evidence",Sue Grafton,,"Women detectives, Detective and mystery stories, Open Library Staff Picks, Women private investigators, Fiction, Kinsey Millhone (Fictitious character), Private investigators, Fiction, mystery & detective, women sleuths, Millhone, kinsey (fictitious character), fiction, California, fiction, Santa teresa (calif. : imaginary place), fiction, Private investigators, fiction, Large type books","""E"" is for evidence Sue Grafton Women detectives, Detective and mystery stories, Open Library Staff Picks, Women private investigators, Fiction, Kinsey Millhone (Fictitious character), Private investigators, Fiction, mystery & detective, women sleuths, Millhone, kinsey (fictitious character), fiction, California, fiction, Santa teresa (calif. : imaginary place), fiction, Private investigators, fiction, Large type books",
0553279912,"""A"" is for alibi",Sue Grafton,,"Foreign speakers, Detective and mystery stories, Private investigators in fiction, Women private investigators, Open Library Staff Picks, Private investigators, English language, Fiction, Study and teaching, Readers (Adult), Women detectives in fiction, Women private investigators in fiction, California in fiction, Women detectives, Kinsey Millhone (Fictitious character), Millhone, kinsey (fictitious character), fiction, Fiction, mystery & detective, women sleuths, Private investigators, fiction, Santa teresa (calif. : imaginary place), fiction, California, fiction, FICTION / Mystery & Detective / Private Investigators, FICTION / Mystery & Detective / Women Sleuths, Mystery fiction, Mystery and detective stories","""A"" is for alibi Sue Grafton Foreign speakers, Detective and mystery stories, Private investigators in fiction, Women private investigators, Open Library Staff Picks, Private investigators, English language, Fiction, Study and teaching, Readers (Adult), Women detectives in fiction, Women private investigators in fiction, California in fiction, Women detectives, Kinsey Millhone (Fictitious character), Millhone, kinsey (fictitious character), fiction, Fiction, mystery & detective, women sleuths, Private investigators, fiction, Santa teresa (calif. : imaginary place), fiction, California, fiction, FICTION / Mystery & Detective / Private Investigators, FICTION / Mystery & Detective / Women Sleuths, Mystery fiction, Mystery and detective stories",
0553280341,B is for burglar.,Sue Grafton,,"Fiction, Kinsey Millhone (Fictitious character), Women private investigators, Burglary, Private investigators, Women detectives, Millhone, kinsey (fictitious character), fiction, Fiction, mystery & detective, women sleuths, Santa teresa (calif. : imaginary place), fiction, Private investigators, fiction, Large type books, Detective and mystery stories, Kinsey Millhone (Fictional character), Mystery fiction, Mystery and detective stories","B is for burglar. Sue Grafton Fiction, Kinsey Millhone (Fictitious character), Women private investigators, Burglary, Private investigators, Women detectives, Millhone, kinsey (fictitious character), fiction, Fiction, mystery & detective, women sleuths, Santa teresa (calif. : imaginary place), fiction, Private investigators, fiction, Large type books, Detective and mystery stories, Kinsey Millhone (Fictional character), Mystery fiction, Mystery and detective stories",
0553572997,The alienist,Caleb Carr,,"Fiction, Serial murders, Mystery fiction, Historical fiction, Serial murders -- Fiction, Psychologists, Police corruption, Journalists, Serial murders, fiction, New york (n.y.), fiction, Fiction, mystery & detective, general, Fiction, historical, Homicide, Large type books, New York Times reviewed, Kreizler, laszlo (fictitious character), fiction, Forensic psychiatrists, fiction, Fiction, historical, general, Asesinatos seriales, Novela policíaca, Ficción, Novela histórica, Unabridged Books on compact disc, Audiobooks, Novela policíaca americana, Novela policíaca americana -- Ficción, New York (N.Y.) -- Fiction, Nueva York (N.Y.) -- Ficción, Fiction, thrillers, general, Fiction, suspense, Fiction, mystery & detective, historical","The alienist Caleb Carr Fiction, Serial murders, Mystery fiction, Historical fiction, Serial murders -- Fiction, Psychologists, Police corruption, Journalists, Serial murders, fiction, New york (n.y.), fiction, Fiction, mystery & detective, general, Fiction, historical, Homicide, Large type books, New York Times reviewed, Kreizler, laszlo (fictitious character), fiction, Forensic psychiatrists, fiction, Fiction, historical, general, Asesinatos seriales, Novela policíaca, Ficción, Novela histórica, Unabridged Books on compact disc, Audiobooks, Novela policíaca americana, Novela policíaca americana -- Ficción, New York (N.Y.) -- Fiction, Nueva York (N.Y.) -- Ficción, Fiction, thrillers, general, Fiction, suspense, Fiction, mystery & detective, historical",
0671001795,Two for the dough,Janet Evanovich,,"Bounty hunters, Fiction, Stephanie Plum (Fictitious character), Women detectives, Mystery fiction, Private investigators, Detective and mystery stories, Large type books, Fiction, mystery & detective, women sleuths, Plum, stephanie (fictitious character), fiction, Trenton (n.j.), fiction, Fiction, humorous, nyt:e-book-fiction=2012-02-19, New York Times bestseller, Fiction, humorous, general, Fiction, thrillers, crime, Fiction, crime, Fiction, media tie-in","Two for the dough Janet Evanovich Bounty hunters, Fiction, Stephanie Plum (Fictitious character), Women detectives, Mystery fiction, Private investigators, Detective and mystery stories, Large type books, Fiction, mystery & detective, women sleuths, Plum, stephanie (fictitious character), fiction, Trenton (n.j.), fiction, Fiction, humorous, nyt:e-book-fiction=2012-02-19, New York Times bestseller, Fiction, humorous, general, Fiction, thrillers, crime, Fiction, crime, Fiction, media tie-in",
0671021001,She's come undone,Wally Lamb,,"Self-perception, Fiction, Fiction, psychological, Fiction, coming of age, Young women, fiction","She's come undone Wally Lamb Self-perception, Fiction, Fiction, psychological, Fiction, coming of age, Young women, fiction",
0679750304,The culture of desire,"Frank Browning, Frank Browning",,"Gay men, Lifestyles, Gay culture, Subculture, Sexuality, Identity","The culture of desire Frank Browning, Frank Browning Gay men, Lifestyles, Gay culture, Subculture, Sexuality, Identity",
067976402X,Snow Falling on Cedars,David Guterson,,"Dear John letters, internment camps, strawberries, 442nd Regimental Combat Team, attack on Pearl Harbor, fishermen, anti-Japanese sentiments, U.S. Marine Corps, Battle of Tarawa, Modern & contemporary fiction, murder trials, legal stories, Japanese Americans, Japanese Americans in fiction, award:pen_faulkner_award=fiction, Trials (Murder), PEN/Faulkner Award Winner, Journalists in fiction, Open Library Staff Picks, award:pen_faulkner_award=1995, Journalists, Fiction, Trials (Homicide), Japaner, 20th century, American literature, Fictional Works, University of South Alabama, Deutscher Einwanderer, Mord, Washington (state), fiction, Journalists, fiction, Japanese americans, fiction, Fiction, legal, French language, Trials (Murder.), Liability for hazardous substances pollution damages, Trials, united states, Toxic torts, Groundwater, pollution, Fiction, general, Fiction, short stories (single author), Japanese americans--washington (state)--fiction, Trials (murder)--washington (state)--fiction, Journalists--washington (state)--fiction, Japanese americans--fiction, Trials (murder)--fiction, Journalists--fiction, --fictional works, Ps3557.u846 s65 1995, 813/.54","Snow Falling on Cedars David Guterson Dear John letters, internment camps, strawberries, 442nd Regimental Combat Team, attack on Pearl Harbor, fishermen, anti-Japanese sentiments, U.S. Marine Corps, Battle of Tarawa, Modern & contemporary fiction, murder trials, legal stories, Japanese Americans, Japanese Americans in fiction, award:pen_faulkner_award=fiction, Trials (Murder), PEN/Faulkner Award Winner, Journalists in fiction, Open Library Staff Picks, award:pen_faulkner_award=1995, Journalists, Fiction, Trials (Homicide), Japaner, 20th century, American literature, Fictional Works, University of South Alabama, Deutscher Einwanderer, Mord, Washington (state), fiction, Journalists, fiction, Japanese americans, fiction, Fiction, legal, French language, Trials (Murder.), Liability for hazardous substances pollution damages, Trials, united states, Toxic torts, Groundwater, pollution, Fiction, general, Fiction, short stories (single author), Japanese americans--washington (state)--fiction, Trials (murder)--washington (state)--fiction, Journalists--washington (state)--fiction, Japanese americans--fiction, Trials (murder)--fiction, Journalists--fiction, --fictional works, Ps3557.u846 s65 1995, 813/.54","Snow Falling on Cedars is a 1994 novel by David Guterson. Guterson, a teacher, wrote the book in the early morning hours over ten years, until eventually quitting his job to write full-time, following its success."
068484477X,Stones from the river,Ursula Hegi,,"City and town life, Dwarfs, Fiction, Historical fiction, History, History 20th century, Women librarians, English fiction, United States, Germany, fiction, Librarians, fiction, Fiction, historical, Large type books, Dwarfs (Persons), Librarians, Fiction, historical, general","Stones from the river Ursula Hegi City and town life, Dwarfs, Fiction, Historical fiction, History, History 20th century, Women librarians, English fiction, United States, Germany, fiction, Librarians, fiction, Fiction, historical, Large type books, Dwarfs (Persons), Librarians, Fiction, historical, general","Stones from the River is the third-person omniscient 1994 novel by Ursula Hegi which chronicles 40 years of the life of Trudi, a woman with dwarfism, as she navigates the silently complicit, violent, and redemptive era of World War I and II Germany in the fictional town of Burgdorf.
Ursula Hegi's status as a German immigrant to America played a key role in shaping Stones from the River.
Stones from the River received multiple accolades and became a bestseller in 1997 when selected for Oprah's Book Club."
080410753X,The Kitchen God's Wife,Amy Tan,,"Chinese fiction, Family, Fiction, California, fiction, China, fiction, Fiction, family life, general, Mothers and daughters, fiction, Chinese Americans, fiction, Chinese American families, fiction, Chinese, Literature, Romance, United States, Domestic fiction, +Fiction, Families, Female friendship, Mother-daughter relationship, FICTION / Sagas, FICTION / Asian American, FICTION / Literary, Large type books, Literary Criticism, Nonfiction, Fiction, short stories (single author), Literature, modern, outlines, syllabi, etc., Modern Literature, Asian Americans, Mother-Child Relations, Chinese American families, Chinese Americans, Mothers and daughters","The Kitchen God's Wife Amy Tan Chinese fiction, Family, Fiction, California, fiction, China, fiction, Fiction, family life, general, Mothers and daughters, fiction, Chinese Americans, fiction, Chinese American families, fiction, Chinese, Literature, Romance, United States, Domestic fiction, +Fiction, Families, Female friendship, Mother-daughter relationship, FICTION / Sagas, FICTION / Asian American, FICTION / Literary, Large type books, Literary Criticism, Nonfiction, Fiction, short stories (single author), Literature, modern, outlines, syllabi, etc., Modern Literature, Asian Americans, Mother-Child Relations, Chinese American families, Chinese Americans, Mothers and daughters","The Kitchen God's Wife is the second novel by Chinese-American author Amy Tan. First published in 1991, it deals extensively with Chinese-American female identity and draws on the story of her mother's life."
0006471161,The sum of all fears,Tom Clancy,,"Intelligence service, Jack Ryan (Fictitious character), Fiction, Nuclear warfare, Spies, Open Library Staff Picks, Terrorism, Spy stories, Ryan, Jack (Fictitious character) -- Fiction, Intelligence service -- United States -- Fiction, Terrorism, fiction, Fiction, thrillers, general, Middle east, fiction, Ryan, jack (fictitious character), fiction, Fiction, espionage, Clark, john (fictitious character), fiction, Large type books, Sr. Ryan, Jack (Fictitious character), Fiction, thrillers, espionage, Computer games","The sum of all fears Tom Clancy Intelligence service, Jack Ryan (Fictitious character), Fiction, Nuclear warfare, Spies, Open Library Staff Picks, Terrorism, Spy stories, Ryan, Jack (Fictitious character) -- Fiction, Intelligence service -- United States -- Fiction, Terrorism, fiction, Fiction, thrillers, general, Middle east, fiction, Ryan, jack (fictitious character), fiction, Fiction, espionage, Clark, john (fictitious character), fiction, Large type books, Sr. Ryan, Jack (Fictitious character), Fiction, thrillers, espionage, Computer games","The Sum of All Fears is a political thriller novel, written by Tom Clancy and released on August 14, 1991, as the sequel to Clear and Present Danger (1989). Main character Jack Ryan, who is now the Deputy Director of Central Intelligence, tries to stop a crisis concerning the Middle East peace process wherein Palestinian and former East German terrorists conspire to bring the United States and Soviet Union into nuclear war. It debuted at number one on the New York Times bestseller list."
0060928336,Divine Secrets of the Ya-Ya Sisterhood,Rebecca Wells,,"Fiction, Literature, Conflict of generations, Family, Female friendship, Mothers and daughters, Women, Friendship, Families, Literary, Fiction - General, Fiction / General, General, Fiction, family life, Mothers and daughters, fiction, Friendship, fiction, Louisiana, fiction, Washington (state), fiction, Mother-daughter relationship, Louisiana, Fiction, general","Divine Secrets of the Ya-Ya Sisterhood Rebecca Wells Fiction, Literature, Conflict of generations, Family, Female friendship, Mothers and daughters, Women, Friendship, Families, Literary, Fiction - General, Fiction / General, General, Fiction, family life, Mothers and daughters, fiction, Friendship, fiction, Louisiana, fiction, Washington (state), fiction, Mother-daughter relationship, Louisiana, Fiction, general","Divine Secrets of the Ya-Ya Sisterhood is a 1996 novel written by Rebecca Wells. It follows the novel Little Altars Everywhere. In 2005, Wells wrote Ya-Yas in Bloom and then The Crowning Glory of Calla Lily Ponder."
0060971479,The all of it,Jeannette Haien,,"Confession in fiction, Brothers and sisters, Literature, Confession, Fiction, Brothers and sisters in fiction, Brothers and sisters, fiction, Siblings, fiction, Clergy, Doctrines, Salmon fishing, Spouses, Widows, Catholic Church","The all of it Jeannette Haien Confession in fiction, Brothers and sisters, Literature, Confession, Fiction, Brothers and sisters in fiction, Brothers and sisters, fiction, Siblings, fiction, Clergy, Doctrines, Salmon fishing, Spouses, Widows, Catholic Church",
0060976845,Little altars everywhere,"Wells, Rebecca",,"Fiction, Catholics, Family, Dysfunctional families, Problem families, Families, Louisiana, fiction, Fiction, general","Little altars everywhere Wells, Rebecca Fiction, Catholics, Family, Dysfunctional families, Problem families, Families, Louisiana, fiction, Fiction, general",
0061009059,One for the Money,"Janet Evanovich, Janet Evanovich",,"Women detectives, Detective and mystery stories, Bounty hunters, Stephanie Plum (Fictitious character), Private investigators, nyt:mass_market_paperback=2011-12-17, Fiction, New York Times bestseller, Plum, stephanie (fictitious character), fiction, Fiction, mystery & detective, women sleuths, Trenton (n.j.), fiction, Mystery and detective stories, Mystery fiction, Mystery & Detective, Large type books, humor, mystrey","One for the Money Janet Evanovich, Janet Evanovich Women detectives, Detective and mystery stories, Bounty hunters, Stephanie Plum (Fictitious character), Private investigators, nyt:mass_market_paperback=2011-12-17, Fiction, New York Times bestseller, Plum, stephanie (fictitious character), fiction, Fiction, mystery & detective, women sleuths, Trenton (n.j.), fiction, Mystery and detective stories, Mystery fiction, Mystery & Detective, Large type books, humor, mystrey","""One for the Money"" is an English-language children's rhyme. Children have used it as early as the 1820s to count before starting a race or other activity."
006101351X,The perfect storm,"Sebastian Junger, Anne Collins",,"Social life and customs, Foreign speakers, Andrea Gail (Boat), Andrea Gail (Ship), Open Library Staff Picks, Halloween Nor'easter, 1991, Swordfish fisheries, English language, Northeast storms, Fisheries, Natural disasters, Study and teaching, Readers (Adult), Hurricane Grace, 1991, Shipwrecks, Swordfish fishing, History, Fishers, Ships, ELT graded readers, American English, Reading Level-Grade 11, Reading Level-Grade 12, Massachusetts, social life and customs, Seafaring life, Storms, Severe storms, Survival, Tropical Storm Grace, 1997, New York Times reviewed, Alex award, Film novelizations, Manners and customs, Gloucester (Mass.), Social life & customs, Disasters","The perfect storm Sebastian Junger, Anne Collins Social life and customs, Foreign speakers, Andrea Gail (Boat), Andrea Gail (Ship), Open Library Staff Picks, Halloween Nor'easter, 1991, Swordfish fisheries, English language, Northeast storms, Fisheries, Natural disasters, Study and teaching, Readers (Adult), Hurricane Grace, 1991, Shipwrecks, Swordfish fishing, History, Fishers, Ships, ELT graded readers, American English, Reading Level-Grade 11, Reading Level-Grade 12, Massachusetts, social life and customs, Seafaring life, Storms, Severe storms, Survival, Tropical Storm Grace, 1997, New York Times reviewed, Alex award, Film novelizations, Manners and customs, Gloucester (Mass.), Social life & customs, Disasters",
0061097101,The saving graces,Patricia Gaffney,,"Female friendship, Fiction, Friendship, Women, Large type books, Friendship, fiction, Fiction, general, Washington (d.c.), fiction","The saving graces Patricia Gaffney Female friendship, Fiction, Friendship, Women, Large type books, Friendship, fiction, Fiction, general, Washington (d.c.), fiction",
0070212570,Fried green tomatoes at the Whistle Stop Cafe,"Fannie Flagg, Akiko Izumi",,"Race relations, Reminiscing in old age, Female friendship, Romance norte americano, Fiction, Lesbians, Women, Domestic fiction, Love stories, Restaurants, Reminiscing in old age -- Fiction., Friendship, Female friendship -- Fiction., Women -- Alabama -- Fiction., Race relations -- Fiction., Restaurants -- Fiction., Lesbians -- Fiction., Alabama -- Fiction., Fiction, general, Alabama, fiction, Large type books, Lesbians, fiction, Kvinnlig vänskap, Skönlitteratur, LGBTQ novels, Fiction, family life, general, Fiction, romance, general, Friendship, fiction","Fried green tomatoes at the Whistle Stop Cafe Fannie Flagg, Akiko Izumi Race relations, Reminiscing in old age, Female friendship, Romance norte americano, Fiction, Lesbians, Women, Domestic fiction, Love stories, Restaurants, Reminiscing in old age -- Fiction., Friendship, Female friendship -- Fiction., Women -- Alabama -- Fiction., Race relations -- Fiction., Restaurants -- Fiction., Lesbians -- Fiction., Alabama -- Fiction., Fiction, general, Alabama, fiction, Large type books, Lesbians, fiction, Kvinnlig vänskap, Skönlitteratur, LGBTQ novels, Fiction, family life, general, Fiction, romance, general, Friendship, fiction",
00992551809,,,,,,Nan or NAN may refer to:
0140266445,Love You to Bits and Pieces,"Gillian Helfgott, Alissa Tanskaya",,"Helfgott, David, Mentally ill, Biography, Pianists, Pianists, biography, Australia, biography","Love You to Bits and Pieces Gillian Helfgott, Alissa Tanskaya Helfgott, David, Mentally ill, Biography, Pianists, Pianists, biography, Australia, biography",
0140293248,The girls' guide to hunting and fishing,Melissa Bank,,"Fiction, Social life and customs, Young women, Man-woman relationships, American Love stories, Literature, Love stories, American, American Romance fiction, Manners and customs, American Chick lit, Large type books, Fiction, romance, contemporary, Man-woman relationships, fiction, United states, social life and customs, fiction, Young women, fiction, United states, fiction, Fiction, general","The girls' guide to hunting and fishing Melissa Bank Fiction, Social life and customs, Young women, Man-woman relationships, American Love stories, Literature, Love stories, American, American Romance fiction, Manners and customs, American Chick lit, Large type books, Fiction, romance, contemporary, Man-woman relationships, fiction, United states, social life and customs, fiction, Young women, fiction, United states, fiction, Fiction, general",
0140480536,Heartbreak House,George Bernard Shaw,,"Manuscripts, Facsimiles, Drama, Upper class, British and irish drama (dramatic works by one author)","Heartbreak House George Bernard Shaw Manuscripts, Facsimiles, Drama, Upper class, British and irish drama (dramatic works by one author)","Heartbreak House: A Fantasia in the Russian Manner on English Themes is a play written by Bernard Shaw during the First World War, published in 1919 and first performed in November 1920 at the Garrick Theatre, New York, followed by a West End production the following year.
The play reflects Shaw's disillusion with post-war Britain. It contrasts cultured but self-absorbed and politically irresponsible people on the one hand and aggressive philistines on the other."
0142001740,The  secret life of bees,"Sue Monk Kidd, Sue Kidd",,"Teenage girls, Fiction, South Carolina in fiction, African American women, Beekeepers, Race relations, Literature, Maternal deprivation, Sisters, Domestic fiction, African American women in fiction, Open Library Staff Picks, Beekeepers in fiction, Maternal deprivation in fiction, Race relations in fiction, Sisters in fiction, Teenage girls in fiction, Mothers and daughters, Girls, Racism, Beekeeping, Teenagers, Historical fiction, African Americans, Women, Reading Level-Grade 9, Reading Level-Grade 8, Reading Level-Grade 11, Reading Level-Grade 10, Reading Level-Grade 12, Teenage boy/girl relations, Secrets, Fictional Works, Fiction, family life, South carolina, fiction, African americans, fiction, Sisters, fiction, Fiction, coming of age, Afrcian American Women, nyt:trade-fiction-paperback=2008-07-06, New York Times bestseller, Fiction, historical, general, Fiction, family life, general","The  secret life of bees Sue Monk Kidd, Sue Kidd Teenage girls, Fiction, South Carolina in fiction, African American women, Beekeepers, Race relations, Literature, Maternal deprivation, Sisters, Domestic fiction, African American women in fiction, Open Library Staff Picks, Beekeepers in fiction, Maternal deprivation in fiction, Race relations in fiction, Sisters in fiction, Teenage girls in fiction, Mothers and daughters, Girls, Racism, Beekeeping, Teenagers, Historical fiction, African Americans, Women, Reading Level-Grade 9, Reading Level-Grade 8, Reading Level-Grade 11, Reading Level-Grade 10, Reading Level-Grade 12, Teenage boy/girl relations, Secrets, Fictional Works, Fiction, family life, South carolina, fiction, African americans, fiction, Sisters, fiction, Fiction, coming of age, Afrcian American Women, nyt:trade-fiction-paperback=2008-07-06, New York Times bestseller, Fiction, historical, general, Fiction, family life, general",
0312167792,Bachelor brothers' bed & breakfast pillow book,"Richardson, Bill",,"Bed and breakfast accommodations, Brothers, Fiction, Books and reading, Bachelors, Eccentrics and eccentricities, Twins, Bachelor brothers (fictitious characters), fiction, Canada, fiction, Fiction, humorous, general, British columbia, fiction, Twins, fiction, Brothers, fiction","Bachelor brothers' bed & breakfast pillow book Richardson, Bill Bed and breakfast accommodations, Brothers, Fiction, Books and reading, Bachelors, Eccentrics and eccentricities, Twins, Bachelor brothers (fictitious characters), fiction, Canada, fiction, Fiction, humorous, general, British columbia, fiction, Twins, fiction, Brothers, fiction",
0312195516,The red tent,Anita Diamant,,"Women in the Bible, Fiction, Religious fiction, Bible, History of Biblical events, Kvinnor i bibeln, Skönlitteratur, Bible fiction, Dinah, Women in the bible--fiction, Ps3554.i227 r43 1998, 813/.54","The red tent Anita Diamant Women in the Bible, Fiction, Religious fiction, Bible, History of Biblical events, Kvinnor i bibeln, Skönlitteratur, Bible fiction, Dinah, Women in the bible--fiction, Ps3554.i227 r43 1998, 813/.54",The Red Tent or Red Tent may refer to:
0312983271,Full house,Janet Evanovich,,"Max Holt (Fictitious character), Divorced women, Detective and mystery stories, Jamie Swift (Fictitious character), Open Library Staff Picks, Single mothers, Fiction, Private investigators, Women newspaper editors, Love stories, Detectives, Large type books, Fiction, romance, general, American Humorous stories, Fiction, romance, suspense, Divorced mothers","Full house Janet Evanovich Max Holt (Fictitious character), Divorced women, Detective and mystery stories, Jamie Swift (Fictitious character), Open Library Staff Picks, Single mothers, Fiction, Private investigators, Women newspaper editors, Love stories, Detectives, Large type books, Fiction, romance, general, American Humorous stories, Fiction, romance, suspense, Divorced mothers","Full house or Fullhouse or variation, may refer to:"
