ISBN,title,description,authors,publish_date,publisher,number_of_pages,subjects
0060987529,Confessions of an Ugly Stepsister,"Is this new land a place where magics really happen? From Gregory Maguire, the acclaimed author of Wicked, comes his much-anticipated second novel, a brilliant and provocative retelling of the timeless Cinderella tale. In the lives of children, pumpkins can turn into coaches, mice and rats into human beings.... When we grow up, we learn that it's far more common for human beings to turn into rats.... We all have heard the story of Cinderella, the beautiful child cast out to slave among the ashes. But what of her stepsisters, the homely pair exiled into ignominy by the fame of their lovely sibling? What fate befell those untouched by beauty . . . and what curses accompanied Cinderella's exquisite looks? Extreme beauty is an affliction Set against the rich backdrop of seventeenth-century Holland, Confessions of an Ugly Stepsister tells the story of Iris, an unlikely heroine who finds herself swept from the lowly streets of Haarlem to a strange world of wealth, artifice, and ambition. Iris's path quickly becomes intertwined with that of Clara, the mysterious and unnaturally beautiful girl destined to become her sister. Clara was the prettiest child, but was her life the prettiest tale? While Clara retreats to the cinders of the family hearth, burning all memories of her past, Iris seeks out the shadowy secrets of her new household--and the treacherous truth of her former life. God and Satan snarling at each other like dogs.... Imps and fairy godmotbers trying to undo each other's work. How we try to pin the world between opposite extremes! Far more than a mere fairy-tale, Confessions of an Ugly Stepsister is a novel of beauty and betrayal, illusion and understanding, reminding us that deception can be unearthed--and love unveiled--in the most unexpected of places.",Gregory Maguire,2000-10-03,Harper Collins,406.0,Fiction
0671004573,Before I Say Good-Bye,"A young woman probing into the mysterious circumstances of her husband's death receives a message from a medium claiming to be his channel in Mary Higgins Clark's #1 bestselling thriller, Before I Say Goodbye. When Nell MacDermott learns that her husband, architect Adam Cauliff, and three of his business associates have died in an explosion of his new cabin cruiser, she is not only devastated but wracked with guilt. The last time she saw Adam, they had a bitter quarrel over her plan to run for the congressional seat long held by her grandfather; she had told him not to come home. As the investigation into the boat's explosion proceeds, Nell learns that it was not an accident but a bomb. Despite her skepticism, Nell is swayed by her great-aunt Gert, a believer in psychic powers, to see a medium claiming to be Adam's channel. While trying to unravel the threads of Adam's past and his violent end, Nell consults the medium, who transmits messages to her with instructions from Adam. The story reaches a powerful climax in Nell's final encounter with the medium, in which she learns the truth about the explosion—truth she can't be allowed to live and tell.",Mary Higgins Clark,2001-04-01,Pocket Books,0.0,Fiction
0373272839,Letters to Kelly,"Falsely imprisoned on trumped up charged in Central America, Jax Winchester's memory of Kelly O'Brien is the only thing that keeps him going. Released after two years, Jax is determined to claim her as his own. Original.",Suzanne Brockmann,2003,Silhouette,0.0,Ex-convicts
0439139600,,,,,,,
0380718332,All That Remains,"Dr. Kay Scarpetta is up against a serial killer who targets young lovers. Four couples have disappeared, only to turn up dead months afterward...Now a fifth pair is missing, and the mother of the girl is a powerhouse recently named by the president to head his war on drugs.",Patricia Cornwell,1993-07-01,Avon,412.0,Fiction
1559029838,Captains Courageous,Portugese fisherman teaches human values to a spoiled young millionaire's son who was saved from drowning.,Rudyard Kipling,1897,Castrovilli Giuseppe,218.0,Adventure stories
0060915544,,,,,,,
039480029X,Hop on Pop,"Introduce children to Dr. Seuss’s wonderfully witty wordplay with this classic rhyming picture book, known as “the simplest Seuss for youngest use.” HOP POP We like to hop. We like to hop on top of Pop. See Red and Ned and Ted and Ed in a bed. And giggle as Pat sits on a hat and on a cat and on a bat...but a cactus? Pat must NOT sit on that! Full of short, simple words and silly rhymes, the rollicking rhythm of Hop on Pop will keep children of all ages entertained throughout. Beginner Books are fun, funny, and easy to read! Launched by Dr. Seuss in 1957 with the publication of The Cat in the Hat, this beloved early reader series motivates children to read on their own by using simple words with illustrations that give clues to their meaning. Featuring a combination of kid appeal, supportive vocabulary, and bright, cheerful art, Beginner Books will encourage a love of reading in children ages 3–7.",Dr. Seuss,1963-02-12,Random House Books for Young Readers,73.0,Juvenile Fiction
0451174968,,,,,,,
080411109X,The Hundred Secret Senses,"Chinese-American Olivia Laguni has a battle of wills with her half-sister and lifelong nemesis, Kwan Li, whose haunting predictions and implementation of the secret senses link their family's struggles to the challenges of their ancestors. Reprint.",Amy Tan,1995,Ivy Books,418.0,Fiction
0440223016,A Long Fatal Love Chase,"""I'd gladly sell my soul to Satan for a year of freedom,"" cries impetuous Rosamond Vivian to her callous grandfather. Then, one stormy night, a brooding stranger appears in her remote island home, ready to take Rosamond to her word. Spellbound by the mysterious Philip Tempest, Rosamond is seduced with promises of love and freedom, then spirited away on Tempest's sumptuous yacht. But she soon finds herself trapped in a web of intrigue, cruelty, and deceit. Desperate to escape, she flees to Italy, France, and Germany, from Parisian garret to mental asylum, from convent to chateau, as Tempest stalks every step of the fiery beauty who has become his obsession. A story of dark love and passionate obsession that was considered ""too sensational"" to be published in the authors lifetime, A Long Fatal Love Chase was written for magazine serialization in 1866, two years before the publication of Little Women. Buried among Louisa May Alcott's papers for more than a century, its publication is a literary landmark—a novel that is bold, timeless, and mesmerizing.""",Louisa May Alcott,1996-12-02,Dell,370.0,Fiction
0099288850,Tulip Fever,"The story of sexual betrayal and human failings in 17th-century Amsterdam, as the characters move inexorably towards a grand deception and a tragic climax. (Payot.ch)",Deborah Moggach,2000-03-14,Vintage Books,302.0,Fiction
0140384510,"Roll of Thunder, Hear My Cry","The stunning repackage of a timeless Newbery Award Winner, with cover art by two-time Caldecott Honor Award winner Kadir Nelson! With the land to hold them together, nothing can tear the Logans apart. Why is the land so important to Cassie's family? It takes the events of one turbulent year—the year of the night riders and the burnings, the year a white girl humiliates Cassie in public simply because she is black—to show Cassie that having a place of their own is the Logan family's lifeblood. It is the land that gives the Logans their courage and pride, for no matter how others may degrade them, the Logans possess soemthing no one can take away. ""[Taylor] writes not with rancor or bitterness of indignities, but with pride, strength, and respect for humanity.""—The New York Times Book Review ""The vivid story of a black family whose warm ties to each other and their land give them strength to defy rural Southern racism during the Depression . . . Entirely through its own internal development, the novel shows the rich inner rewards of black pride, love, and independence despite the certainty of outer defeat.""—Booklist, starred review * Newbery Medal winner * A National Book Award Nominee * American Book Award Honor Book * An ALA Notable Book * A NCSS-CBC Notable Children's Trade Book in the Field of Social Studies * A Boston Globe-Horn Book Award Honor Book",Mildred D. Taylor,2001-11-27,Penguin,305.0,Juvenile Fiction
006103102X,Murder Boogies with Elvis,"Oversized, outrageous Mary Alice and her prim sister Patricia Anne have been looking forward to the gala benefit being staged to raise money for the restoration of Vulcan, Birmingham's ever-tarnishing unnatural wonder. And what a show it is, with a grand finale that has thirty sequined Elvis impersonators high-kicking in unison! From the front row, ""Mouse"" and ""Sister"" have a perfect view of the action when one of the dancing Kings keels over dead into the bandstand. This Elvis clone has not only left the building ... he's left this life, courtesy of a switchblade knife in the back. And when the murder weapon turns up in Patricia Anne's very sensible purse, the perennially law-abiding ""Mouse"" is understandably all shook up. Suspicious minds have her pegged as the prime suspect in this bizarre case of Elvis elimination. And if she doesn't do some serious sleuthing, she could end up doing the Jailhouse Rock!",Anne George,2002-11-05,Avon,288.0,Fiction
067165604X,Ethan of Athos,"When a mysterious genetic crisis threatens the existence of Athos, a planet forbidden to women, obstetrician Ethan Urquhart is forced into an alliance with Elli Quinn, a gorgeous female secret agent, to save his world.",Bujold,1986-12-15,Baen,0.0,Fiction
