ISBN,title,description,authors,publish_date,publisher,number_of_pages,subjects
0553578731,"I, Jedi: Star Wars Legends","The dramatic story of an X-wing pilot on the razor’s edge between the hero he once was and the power he could have—if he’s willing to embrace the Dark Side Corran Horn was an officer in the Corellian Security Force before casting his lot with the New Republic. As the grandson of a legendary Jedi hero, he has latent Force powers that have yet to be developed. But he has managed to distinguish himself with Rogue Squadron, the X-wing fighter force that has become the scourge of the Empire and of the pirates that prey on Republic shipping. When his wife, Mirax, vanishes on a covert mission for the New Republic, Corran vows to find her. He begins Jedi training at Luke Skywalker’s Jedi academy, hoping to develop his untapped powers. But as Corran grows dissatisfied with the Jedi master’s methods, he chooses to break with the academy before his training is finished. Now Corran is on his own. Using his undercover experience, he must infiltrate, sabotage, and destroy a ruthless organization in order to find his wife. But to succeed, Corran will have to come to terms with his Jedi heritage—and make a terrible choice: surrender to the Dark Side . . . or die.",Michael A. Stackpole,1999-06-01,Random House Worlds,610.0,Fiction
0440211727,A Time to Kill,Courtroom drama of an inhuman crime.,John Grisham,1992,Dell,530.0,Fiction
0553268880,The Prince of Tides,A novel about a man's struggle to overcome the psychological damage inflicted on him during his dysfunctional childhood.,Pat Conroy,1987,Bantam,674.0,Fiction
0553580337,Dune,"Chronicles the origins of the rivalry between Duke Leto and Baron Vladimir Harkonnen, the actions that transformed Duncan Idaho and Gurney Halleck into heroes, the birth of Paul Atreides, and the creation of the tyrannical Padishah Emperor Shaddam Corrino","Brian Herbert, Kevin J. Anderson",2002,Spectra,688.0,Fiction
0451184963,Insomnia,A man starts to notice a strangeness in his surroundings and starts to experience visual phenomena.,Stephen King,1995,Signet Book,676.0,Fiction
0821773682,,,,,,,
0373272081,In the Line of Fire,"In The Line Of Fire by Beverly Bird released on Feb 22, 2002 is available now for purchase.",Beverly Bird,2003,Harlequin Treasury-Silhouette Intim,0.0,Country clubs
0385722206,Balzac and the Little Chinese Seamstress,"New York Times Bestseller Balzac and the Little Chinese Seamstress is an enchanting tale that captures the magic of reading and the wonder of romantic awakening. An immediate international bestseller, it tells the story of two hapless city boys exiled to a remote mountain village for re-education during China’s infamous Cultural Revolution. There the two friends meet the daughter of the local tailor and discover a hidden stash of Western classics in Chinese translation. As they flirt with the seamstress and secretly devour these banned works, the two friends find transit from their grim surroundings to worlds they never imagined.",Dai Sijie,2002-10-29,Vintage,196.0,Fiction
0061094145,Imajica I,"Clive Barker creates an unforgettable realm, the Imajica--five dominions of which one, the Earth, is isolated from the others. Formerly published as one volume, Imajica is now available as Books I and II. The stunning new repackage will appeal to old fans of the book and will draw new readers to this classic work.",Clive Barker,1995-05-10,Harper Collins,548.0,Fiction
0394800206,"Go, Dog. Go!","NATIONAL BESTSELLER • P.D. Eastman's canine classic—perfect for fans of the Netlix Original Go, Dog. Go! animated preschool series! Written for beginning readers using only 75 different words, this beloved Beginner Book by P.D. Eastman—edited by Dr. Seuss—features all kinds of wonderful dogs riding bicycles, scooters, skiis, roller skates, and driving all sorts of vehicles on their way to a party held on top of a tree! This is a perfect gift for P.D. Eastman fans and dog lovers of all ages! Beginner Books are fun, funny, and easy to read! Launched by Dr. Seuss in 1957 with the publication of The Cat in the Hat, this beloved early reader series motivates children to read on their own by using simple words with illustrations that give clues to their meaning. Featuring a combination of kid appeal, supportive vocabulary, and bright, cheerful art, Beginner Books will encourage a love of reading in children. ""The canine cartoons make an elementary text funny and coherent and still one of the best around."" —School Library Journal.",P.D. Eastman,1961-03-12,Random House Books for Young Readers,78.0,Juvenile Fiction
0451180429,The Quiet Game,"INTRODUCING PENN CAGE... From the author of Cemetery Road comes the first intelligent, gripping thriller in the #1 New York Times bestselling Penn Cage series. Natchez, Mississippi. Jewel of the South. City of old money and older sins. And childhood home of Houston prosecutor Penn Cage. In the aftermath of a personal tragedy, this is where Penn has returned for solitude. This is where he hopes to find peace. What he discovers instead is his own family trapped in a mystery buried for thirty years but never forgotten—the town’s darkest secret, now set to trap and destroy Penn as well.",Greg Iles,2000-07-01,Penguin,596.0,Fiction
0441003389,Freedom's Landing,"Kristin Bjornsen lived a normal life, right up until the day the spaceships floated into view above Denver. As human slaves were herded into the maw of a massive vessel, Kristin realized her normal life was over and her fight for freedom was just beginning… The alien Catteni value strength and intelligence in their slaves—and Kristin has managed to survive her enslavement while hundreds of other humans have not. But her trial has just begun, for now she finds herself part of a massive experiment. The aliens have discovered a new world, and they have a simple way of finding out if it’s habitable: drop hundreds of slaves on the surface and see what happens. If they survive, colonization can begin. If not, there are always more slaves.",Anne McCaffrey,1996-06-01,National Geographic Books,0.0,Fiction
0964631601,,,,,,,
055314300X,The Bourne Identity,"A man is shot, left for dead, later rescued from the sea. Surviving but with no memory, he is given a name: Jason Bourne. Physically and mentally agile, he retraces his past through a harrowing personal labyrinth. The discovery: He was a trained killer, and now in turn is being hunted by assassins.",Robert Ludlum,1981,Bantam Doubleday Dell Publishing Group,548.0,Fiction
0553250515,The Member of the Wedding,"When she was only twenty-three Carson McCuller's first novel ""The Heart Is A Lonely Hunter, created a literary sensation. She is very special, once of American's superlative writers who conjures up a vision of existence as terrible as it is real, who takes us on shattering voyages into the depths of the spiritual isolation that underlies the human condition. ""Rarely has emotional turbulence been so delicately conveyed,"" said ""The New York Times of Carson McCullers's achingly real novel about Frankie Addams, a bored twelve-year-old madly jealous of her brother's impending marriage. Frankie was afraid of the dark and envious of the older girls. But as F. Jasmine, in a pink dress, she looked sixteen. No longer a child, she accepted a date with a red-haired soldier and purchased a sophisticated gown for the wedding. F. Jasmine had plans.",Carson McCullers,1973,Bantam,164.0,Drama
0812589041,Ender's Game,Child-hero Ender Wiggin must fight a desperate battle against a deadly alien race if mankind is to survive.,Orson Scott Card,2000-06,Tor Books,349.0,Brothers and sisters
0446364797,The Silken Web,"A beautiful fashion buyer is still in love with someone from her past -- and now, she must choose between him and the man she's planning to marry. Kathleen, a smart and sophisticated woman, is ready to marry the man of her dreams -- but she's in love with someone else. Erik is a talented videographer who finds women easy to love but doesn't want to settle down. And Seth, the wealthy heir to a department store fortune, could give Kathleen everything she wants . . . except the one thing that would make her happy. All three of them are about to get caught up in a web of lies so fragile that one fateful encounter could tear it apart -- and force Kathleen to choose between her family and the needs of her own heart.",Sandra Brown,1993-10-01,Grand Central Publishing,342.0,Fiction
0553580191,Seize the Night,"When children begin disappearing in the small town of Moonlight Bay, the police turn a blind eye and refuse to help look for the children, so Christopher Snow sets out to find them, and he discovers a secret that the entire police force will kill to keep quiet.",Dean Ray Koontz,1999,"Random House Digital, Inc.",486.0,Fiction
0060086661,,,,,,,
0553239813,The Little Drummer Girl,"Charlie, a young English actress, meets a man on a Greek beach who draws her into a world of espionage and terror in the Middle East.",John Le Carré,1984,,534.0,Fiction
0553563327,Thief of Hearts,"Prim and pampered, Lucina Snow knew little of men and nothing of danger, until the fog-shrouded night she found herself abducted--and at the mercy of the legendary Captain Doom. Ruthless and mocking, tender and virile, the notorious pirate awakened all Lucy's passionate longings, then abandoned her with nothing but a kiss... Now safely at home, the alluring waif is tormented by treacherous memories--and by the presence of Gerard Claremont, her mysterious new bodyguard. Everything about him, from his forbidding size to his impertinent manner, sparks her defiance. And even when Gerard's smile turns seductive, no one can make her forget Doom. Yet only when Lucy's path crosses the captain's once more, will she learn who is on a voyage of retribution, and who is out to steal her heart...",Teresa Medeiros,1994,Bantam,0.0,Fiction
1400042070,The Amateur Marriage,"Marrying quickly during World War II after falling in love at first sight, a mismatched couple discovers that their different personalities and approaches to life are taking a toll on their relationship and their family.",Anne Tyler,2004,"Random House Digital, Inc.",328.0,Fiction
0316769487,The Catcher in the Rye,"The ""brilliant, funny, meaningful novel"" (The New Yorker) that established J. D. Salinger as a leading voice in American literature--and that has instilled in millions of readers around the world a lifelong love of books. ""If you really want to hear about it, the first thing you'll probably want to know is where I was born, and what my lousy childhood was like, and how my parents were occupied and all before they had me, and all that David Copperfield kind of crap, but I don't feel like going into it, if you want to know the truth."" The hero-narrator of The Catcher in the Rye is an ancient child of sixteen, a native New Yorker named Holden Caufield. Through circumstances that tend to preclude adult, secondhand description, he leaves his prep school in Pennsylvania and goes underground in New York City for three days.",J.D. Salinger,1991-05-01,"Little, Brown",228.0,Fiction
014013168X,The Buddha of Suburbia,"“A wickedly funny novel” (The New York Times) from the author of SHATTERED “There was one copy going round our school like contraband. I read it in one sitting...I'd never read a book about anyone remotely like me before.”—Zadie Smith My name is Karim Amir, and I am an Englishman born and bred, almost... The hero of Hanif Kureishi's debut novel is dreamy teenager Karim, desperate to escape suburban South London and experience the forbidden fruits which the 1970s seem to offer. When the unlikely opportunity of a life in the theatre announces itself, Karim starts to win the sort of attention he has been craving—albeit with some rude and raucous results. With the publication of The Buddha of Suburbia, Hanif Kureishi landed into the literary landscape as a distinct new voice and a fearless taboo-breaking writer. The novel inspired a ground-breaking BBC series featuring a soundtrack by David Bowie. Winner of the Whitbread Prize for Best First Novel",Hanif Kureishi,1991-05-01,Penguin,289.0,Fiction
0060094850,The Torn Skirt,"I was born with a fever, but it seemed to subside for sixteen years. . . . And then as I turned sixteen and stopped smiling, the fever returned though my skin stayed pale and sure, showing no sign of the heat inside me. At Mt. Douglas (a.k.a. Mt. Drug) High, all the girls have feathered hair, and the sweet scent of Love's Baby Soft can't hide the musk of raw teenage anger, apathy, and desire. Sara Shaw is a girl full of fever and longing, a girl looking for something risky, something real. Her only possible salvation comes in the willowy form of the mysterious Justine, the outlaw girl in the torn skirt. The search for Justine will lead Sara on a daring odyssey into an underworld of hookers and johns, junkies and thieves, runaway girls and skater boys, and, ultimately, into a violent tragedy. One of the most provocative and original coming-of-age novels to appear in a long time, The Torn Skirt is a lyrical story that soars with an honest understanding of the teenage condition.",Rebecca Godfrey,2002,Harper Collins,210.0,Fiction
0440235596,Tara Road,"NEW YORK TIMES BESTSELLER • “A tender novel of the pleasures and pitfalls of friendship Tara Road is an ultramodern love story for women, about women, between women that is sure to delight.”—Newsday New York Times bestselling author Maeve Binchy has captured the hearts of millions with her unforgettable novels. Binchy's graceful storytelling and wise compassion have earned her the devotion of fans worldwide--and made her one of the most beloved authors of our time. Now she dazzles us once again with a new novel filled with her signature warmth, humor, and tender insight. A provocative tale of family heartbreak, friendship, and revelation, Tara Road explores every woman's fantasy: escape, into another place, another life. ""What if . . ."" Binchy asks, and answers in her most astonishing novel to date. Praise for Tara Road “Her best work yet . . . Tara Road is like a total immersion in a colorful new world, where the last page comes too soon.”—Seattle Times “An irresistible tale.”—Elle “Engrossing.”—Wall Street Journal “Difficult to put down!”—Denver Post “One of Binchy's best.”—Kirkus Reviews",Maeve Binchy,2000-07-18,Dell,392.0,Fiction
0060938455,Fast Food Nation,Jack the B.,Eric Schlosser,2002,Harper Perennial,404.0,Business & Economics
0316898163,"River, Cross My Heart","Five-year-old Clara Bynum is dead, drowned in the Potomac River in the shadow of a seemingly haunted rock outcropping known locally as the Three Sisters. River, Cross My Heart, which marks the debut of a wonderfully gifted new storyteller, weighs the effect of Clara's absence on the people she has left behind: her parents, Alice and Willie Bynum, torn between the old world of their rural North Carolina home and the new world of the city, to which they have moved in search of a better life for themselves and their children; the friends and relatives of the Bynum family in the Georgetown neighborhood they now call home; and, most especially, Clara's sister, ten-year-old Johnnie Mae, who must come to terms with the powerful and confused emotions stirred by her sister's death as she struggles to decide what kind of woman she will become. This highly accomplished first novel resonates with ideas, impassioned lyricism, and poignant historical detail as it captures an essential part of the African-American experience in our century.",Breena Clarke,2000-10-01,"Little, Brown",280.0,Fiction
0786886021,Don't Sweat the Small Stuff for Women,"For women everywhere Encouraging and soothing advice on reducing stress and increasing enjoyment, from the co-author of the New York Times bestseller Dont Sweat the Small Stuff in Love. With more than 12 million copies sold and still going strong, the Dont Sweat the Small Stuff series has helped countless readers rethink the way they address lifes big and small problems. Now in a book written specifically for women, Kristine Carlson offers the same calming and encouraging advice in 100 short and spirited essays. Dont Sweat the Small Stuff for Women addresses such important and timely issues as balancing family and work demands, debating effectively with spouses and partners, dealing with children and friendships, finding time for reflection and self-care, and much more. With clever and memorable titles as Dont Be a Backseat Driver (Unless It Could Save Your Life), Know Your Hot Spots, Make Peace with the Mundane, and Stop Comparing Yourself to the Media Measuring Stick, Kristine Carlson helps readers focus on whats really important, keep in touch with their feelings, live with spirit, andwhen all else failslearn to laugh. A true life-saver, this potent book is full of sage advice and comforting thoughts, from one busy woman to another.","Kristine Carlson, Richard Carlson",2001-04-17,Hyperion,292.0,Self-Help
0609608339,The Buffalo Soldier,"After losing their twin daughters in a flash flood, a grief-stricken couple take in a foster child.",Chris Bohjalian,2002,"Random House Digital, Inc.",424.0,Fiction
0880015829,The Sheltering Sky,"When The Sheltering Sky was first published in 1949, it established Paul Bowles as one of the most singular and promising writers of the postwar generation. Its startlingly original vision has withstood the test of time and confirmed Tennessee Williams's early estimation: ""The Sheltering Sky alone of the books that I have . . . read by American authors appears to bear the spiritual imprint of recent history in the western world."" In this classic work of psychological terror, Bowles examines the ways in which Americans apprehend an alien culture and the ways in which their incomprehension destroys them. The story of three worldly young travelers Port Moresby, his wife, Kit, and their friend, Tunner--adrift in the cities and deserts of North Africa after World War II, The Sheltering Sky is merciless in its evocation of the emotional dislocation induced by a foreign setting. As the Americans embark on an ill-fated journey through desolate terrain, they are pushed to the limits of human reason and intelligence by the unfathomable emptiness and impassive cruelty of the desert. Along the way, they encounter a host of enigmatic characters whose inarticulate strangeness seals the travelers off even more completely from the culture in which they are traveling, causing their fierce attachments to one another to unravel. This special fiftieth anniversary commemorative edition of Bowles's unforgettable first novel includes the original New York Times review by Tennessee Williams and a preface the author wrote for his first novel before he died in 1999.",Paul Bowles,1998-04-01,Harper Perennial,320.0,Fiction
0553801279,A Traitor to Memory,"When Eugenie Davies is killed by a driver on a quiet London street, her death is clearly no accident. Someone struck her with a car and then deliberately ran over her body before driving off, leaving nothing behind but questions. What brought Eugenie Davies to London on a rainy autumn night? Why was she carrying the name of the man who found her body? Who among the many acquaintances in her complicated and tragic life could have wanted her dead? And could her murder have some connection to a twenty-eight-year-old musical wunderkind, a virtuoso violinist who several months earlier suddenly and inexplicably lost the ability to play a single note? For Detective Inspector Thomas Lynley, whose own domestic life is about to change radically, these questions are only the first in an investigation that leads him to walk a fine line between personal loyalty and professional honor. Assigned to the case by his superior, Superintendent Malcolm Webberly, Lynley learns that Webberly's first murder investigation as a DI over twenty years ago involved Eugenie Davies and a sensational criminal trial. Yet what is truly damaging is what Webberly already knows and no doubt wants Lynley to keep concealed. Now the pressure is on Lynley to find Eugenie Davies' killer. For not only is he putting his own career into jeopardy, but he is also attempting to safeguard the careers of his longtime partners Barbara Havers and Winston Nkata. Together, they must untangle the dark secrets and darker passions of a family whose history conceals the truth behind a horrific crime. From the Hardcover edition.",Elizabeth George,2001,Bantam,744.0,Fiction
0140293442,Fever Pitch,"A famous account of growing up to be a fanatical football supporter. Told through a series of match reports, FEVER PITCH has enjoyed enormous critical and commercial success since it was first published in 1992. It has helped to create a new kind ofsports writing, and established Hornby as one of the finest writers of his generation.",Nick Hornby,2000,ePenguin,258.0,Biography & Autobiography
0375401156,The Diving Bell and the Butterfly,"The moving memoir of the former editor in chief of French Elle, afflicted by locked-in syndrome, a state of total paralysis, and his determination to live as fully in his mind as he had been able to in his body.",Jean-Dominique Bauby,1997,Knopf Publishing Group,152.0,Biography & Autobiography
0671739743,The Velvet Promise,"All of England rejoiced on her wedding day. But Judith vowed that her husband would get only what he took from her! At the flower-bedecked altar, the first touch of their hands ignited an all-consuming passion. Gavin Montgomery looked deep into her golden eyes and burned with desire for her...but his heart had been pledged to another. Humiliated and alone in a strange castle, Judith resolved to hate this husband who took her body, but rejected her love...never admitting her fear of losing him. But destiny held another fate for Judith...a fate that would keep at last...The Velvet Promise.",Jude Deveraux,1991-01-01,Pocket Books,320.0,Fiction
0842321934,The Vanishings,A six-volume set that centers around four kids who suddenly find themselves alone after millions around the world disappear.,"Jerry B. Jenkins, Tim LaHaye",1998,"Tyndale House Publishers, Inc.",166.0,Juvenile Fiction
0451456726,,,,,,,
0679833692,Juniper,"In this highly acclaimed prequel to the award-winning Wise Child young Princess Juniper returns to her Cornish palace and discovers that her power-mad aunt is using black magic to usurp the throne. And only Juniper can stop her. ""A rich, deeply colored novel of a young girl's coming of age"".--School Library Journal.",Monica Furlong,1992,Laurel Leaf,0.0,Fantasy
0340718153,My Legendary Girlfriend,"Bridget Jones meets High Fidelity in this hilarious story for anyone who has ever been dumped, had to dump, lived in dodgy rented accommodation, or search for love in the 90s.",Mike Gayle,1998,,326.0,Fiction
1551666480,Deadly Intent,"Renowned chef Abbie DiAngelo finds her world shattered by the arrival of her stepbrother, who tries to blackmail her with evidence proving that her mother is guilty of murder, but when he is murdered and her son, Ben, is kidnapped, Abbie must team up with homicide detective John Ryan to find the truth.",Christiane Heggan,2003,MIRA,404.0,Fiction
0345418824,The Harlot by the Side of the Road,"""The stories you are about to read are some of the most violent and sexually explicit in all of Western literature. They are tales of human passion in all of its infinite variety: adultery, seduction, incest, rape, mutilation, assassination, torture, sacrifice, and murder. . . ."" Sex. Violence. Scandal. These are words we rarely associate with the sacred text of the Bible. Yet in this brilliant book, Jonathan Kirsch recounts shocking tales that have been suppressed by religious authorities throughout history. Kirsch places each story within the political and social context of its time, delves into the latest biblical scholarship to explain why each one was originally censored, and shows how these ancient narratives hold valuable lessons for all of us.",Jonathan Kirsch,1998-03-03,Ballantine Books,417.0,Religion
0671661590,Veil,The story of the covert wars that were waged in a secretive atmosphere and became the centerpieces and eventual time bombs of American foreign policy in the 1980s.,Bob Woodward,1988,,708.0,History
0345345738,Women in His Life,"A Main Selection of the Literary Guild and the Doubleday Book Club He is Maximilian West--billionaire tycoon and corporate raider extraordinaire. He is a figure of almost mythical power--an enigma to all who know him. But when his world is suddenly shattered, Maxim must make peace with his turbulent past and begin to understand the remarkable women who have loved and protected him. From the streets of London to the suites of New York, from the rise of Nazi Germany to the fall of the Berlin Wall, THE WOMEN IN HIS LIFE takes us on an unforgettable journey of survival, secrets, love and redemption that mesmerizes from first page to last.",Barbara Taylor Bradford,1991-08-13,Ballantine Books,514.0,Fiction
